title,tag,link,description,date
What is a FHA streamline refinance?,mortgages,https://www.bankrate.com//mortgages/fha-streamline-refinance-loan/,It’s an easy way to swap out your FHA loan — provided you qualify.,"Sep 05, 2024"
Best FHA mortgage lenders in 2024,mortgages,https://www.bankrate.com//mortgages/best-lenders/fha-mortgage-lenders/,"When it comes to these easier-to-qualify-for loans, these lenders are tops.","Aug 08, 2024"
What to do if you inherit a house with a mortgage,mortgages,https://www.bankrate.com//mortgages/inheriting-a-house/,"First off, the mortgage still needs to be repaid — whatever your ultimate plans for the home are.","Aug 27, 2024"
Best VA loan lenders in 2024,mortgages,https://www.bankrate.com//mortgages/best-lenders/va-mortgage-lenders/,A current or veteran military person? Here are the top VA lenders for you.,"Sep 10, 2024"
How to choose a car you’ll love,mortgages,https://www.bankrate.com//loans/auto-loans/finding-the-best-car-for-you/,"There’s no best car for everyone, but there is a best one for you.","Sep 08, 2024"
Best mortgage refinance lenders in 2024,mortgages,https://www.bankrate.com//mortgages/best-lenders/refinance-mortgage-lenders/,Here are some of the best mortgage refinance lenders in 2024.,"Jul 16, 2024"
Cash-out refinance: What it is and how it works,mortgages,https://www.bankrate.com//mortgages/cash-out-refinancing/,A cash-out refi lets you tap your home equity in cash. See if it’s right for you.,"Sep 05, 2024"
Flex Modification Program (FMP): Everything you need to know,mortgages,https://www.bankrate.com//mortgages/flex-modification/,"If you’re behind on your mortgage, a Flex Modification might be able to help.","Jul 17, 2024"
Best mortgage lenders of September 2024,mortgages,https://www.bankrate.com//mortgages/best-lenders/best-mortgage-lenders/,Here are the best mortgage lenders for April 2024.,"Sep 01, 2024"
How to stop foreclosure,mortgages,https://www.bankrate.com//mortgages/how-to-avoid-foreclosure/,Here are strategies for avoiding foreclosure if you have trouble making house payments.,"Jul 12, 2024"
Preforeclosure: What it is and how it works,mortgages,https://www.bankrate.com//mortgages/what-is-preforeclosure/,It’s the first step on the road to losing your home. So avoid it.,"Jun 05, 2024"
Best FHA 203(k) rehab mortgage lenders in 2024,mortgages,https://www.bankrate.com//mortgages/best-lenders/203k-rehab-mortgage-lenders/,Here is Bankrate’s guide to the best 203(k) rehab mortgage lenders.,"Jul 30, 2024"
Best online mortgage lenders in 2024,mortgages,https://www.bankrate.com//mortgages/best-lenders/online-mortgage-lenders/,OK with doing your loan digitally? These mortgage companies are the tops.,"Jul 16, 2024"
Mortgage interest deduction: What it is and what qualifies,mortgages,https://www.bankrate.com//mortgages/mortgage-interest-deduction/,The mortgage interest deduction allows you to reduce your taxable income.,"Sep 05, 2024"
Best mortgage lenders for bad credit in 2024,mortgages,https://www.bankrate.com//mortgages/best-lenders/low-credit-score-mortgage-lenders/,Here are some of the best bad credit mortgage lenders in 2024.,"Jul 19, 2024"
How sports betting income impacts your mortgage application,mortgages,https://www.bankrate.com//mortgages/sports-betting-income-to-qualify-for-mortgage/,"Unless you’re winning on a regular basis, it might be tough to use sports betting income to qualify for a mortgage.","Aug 30, 2024"
Mortgage rate forecast September 2024,mortgages,https://www.bankrate.com//mortgages/mortgage-interest-rates-forecast/,Bankrate’s Greg McBride and others weigh in on what to expect for mortgage rates in September 2024 and beyond.,"Sep 01, 2024"
The mortgage refinance window finally cracks open,mortgages,https://www.bankrate.com//mortgages/mortgage-rate-drops-and-refinances/,But is the reduction in rates worth a rush to redo your loan?,"Sep 12, 2024"
"Mortgage rates drop again, at 19-month low as market waits for Fed",mortgages,https://www.bankrate.com//mortgages/analysis/,How low will they go?,"Sep 11, 2024"
How do discount real estate brokers work?,mortgages,https://www.bankrate.com//real-estate/discount-real-estate-brokers/,Discount real estate brokers cut their commissions. Do they axe services too?,"Jul 29, 2024"
What to know about financial insolvency,mortgages,https://www.bankrate.com//taxes/what-does-it-mean-to-claim-insolvency/,"Insolvency is a difficult financial situation, but it doesn’t have to last forever.","Aug 19, 2024"
How to refinance an underwater mortgage,mortgages,https://www.bankrate.com//mortgages/refinance-an-underwater-mortgage/,"Even if you owe more than your home is worth, there are options to refinance.","Jul 08, 2024"
What is a forbearance agreement?,mortgages,https://www.bankrate.com//mortgages/forbearance-agreement/,Borrowers can request forbearance when there’s a change in their financial situation.,"Jun 06, 2024"
Mortgage refinance: What is it and how does it work?,mortgages,https://www.bankrate.com//mortgages/how-does-refinancing-a-mortgage-work/,Everything you need to know before you start switching out your home loan.,"Sep 05, 2024"
National vs. local mortgage lenders: Which is right for you?,mortgages,https://www.bankrate.com//mortgages/national-vs-local-lender/,"Although lenders can provide the same end product, not all are created equally.","Aug 29, 2024"
Best construction loan lenders in 2024,mortgages,https://www.bankrate.com//mortgages/best-lenders/construction-loan-lenders/,Here is Bankrate’s guide to the best construction loan lenders.,"Aug 08, 2024"
Average mortgage debt in 2024,mortgages,https://www.bankrate.com//mortgages/average-mortgage-debt/,"With climbing home prices necessitating higher loans, average mortgage debt has increased.","Aug 20, 2024"
Biweekly mortgage payments: What they are and how they work,mortgages,https://www.bankrate.com//mortgages/should-you-make-biweekly-mortgage-payments/,"It’s a win-win plan — if you can afford it, of course.","Aug 17, 2024"
What percentage of your income should go to a mortgage?,mortgages,https://www.bankrate.com//mortgages/what-percent-of-income-should-go-to-mortgage/,There are at least two schools of thought on how much it should be.,"Aug 21, 2024"
Conforming vs. nonconforming loans: What’s the difference?,mortgages,https://www.bankrate.com//mortgages/conforming-loan-nonconforming-loan-whats-the-difference/,"One tends to be more expensive, but it also offers more homebuying options.","Aug 20, 2024"
What is PITI?,mortgages,https://www.bankrate.com//mortgages/piti/,"Among other things, it helps lenders decide whether you’ll be able to repay your loan.","Aug 19, 2024"
Key mortgage terms to know: a guide to commonly used phrases,mortgages,https://www.bankrate.com//mortgages/key-mortgage-terms/,"From A(RMs) to V(A loans), the most common words mortgage shoppers should know.","Aug 19, 2024"
APR vs. interest rate: What’s the difference?,mortgages,https://www.bankrate.com//mortgages/apr-and-interest-rate/,The APR and interest rate on your mortgage aren’t the same. Here’s what to pay attention to when you compare costs.,"Aug 15, 2024"
Mortgage wire fraud: Don’t send your down payment without first taking this simple step,mortgages,https://www.bankrate.com//mortgages/mortgage-wire-fraud/,There’s often a very short window to recover home down payment funds wired to scammers.,"Aug 19, 2024"
How to compare lenders for first-time homebuyers,mortgages,https://www.bankrate.com//mortgages/how-to-compare-first-time-homebuyer-lenders/,Select the best mortgage lender for you with these tips.,"Aug 02, 2024"
Should you apply for a mortgage online?,mortgages,https://www.bankrate.com//mortgages/apply-for-mortgages-online/,It’s the 21st century way. But is it the right way for you? Here’s everything to consider.,"Jul 31, 2024"
How does the Federal Reserve affect mortgages?,mortgages,https://www.bankrate.com//mortgages/federal-reserve-and-mortgage-rates/,"The Federal Reserve’s decisions have ripple effects, including for mortgages.","Jul 31, 2024"
What is the first-time homebuyer tax credit?,mortgages,https://www.bankrate.com//mortgages/first-time-homebuyer-tax-credit/,"This once and future tax break for first-timers is still pending. Until it returns, here are alternatives.","Aug 06, 2024"
Mortgage rates fall to year’s lowest levels as investors buy Treasury bonds,mortgages,https://www.bankrate.com//mortgages/mortgage-rates-fall-with-treasury-yields/,Borrowers have a window of opportunity to get or refinance a mortgage.,"Aug 05, 2024"
Should you use a home equity loan to pay off an auto loan?,mortgages,https://www.bankrate.com//home-equity/home-equity-loan-to-pay-off-vehicle-debt/,Probably not. Here are all the pros and cons to consider.,"Aug 02, 2024"
HELOC and home equity loan requirements in 2024,mortgages,https://www.bankrate.com//home-equity/requirements-to-borrow-from-home-equity/,"If you want to borrow from your homeownership stake, these are the factors lenders will judge you on.","Aug 05, 2024"
How many mortgage lenders should I apply to?,mortgages,https://www.bankrate.com//mortgages/multiple-applications/,"Yes, shopping around can make a difference and save you thousands.","Aug 02, 2024"
Behind on mortgage payments? 6 ways to catch up,mortgages,https://www.bankrate.com//mortgages/behind-on-your-mortgage-6-ways-to-catch-up/,Don’t give up on trying to keep your home. One of these strategies might rescue you.,"Aug 08, 2024"
Prepaying your mortgage: What is it and should I do it?,mortgages,https://www.bankrate.com//mortgages/prepaying-your-mortgage/,"Pay a little more every month, and cut your mortgage interest by a lot.","Aug 08, 2024"
"FHA loans: Definition, requirements and limits",mortgages,https://www.bankrate.com//mortgages/what-is-an-fha-loan/,FHA loans can help borrowers with less-than-ideal credit and cash. But they aren’t perfect.,"Aug 09, 2024"
Reverse mortgage requirements,mortgages,https://www.bankrate.com//mortgages/what-are-the-requirements-for-reverse-mortgages/,Qualifying does require jumping through some hoops.,"Aug 07, 2024"
15-year vs. 30-year mortgage: Which is right for you?,mortgages,https://www.bankrate.com//mortgages/15-vs-30-year-mortgage/,"One means lower payments, the other  costs less overall.","Aug 07, 2024"
Mortgage rate history: 1970s to 2024,mortgages,https://www.bankrate.com//mortgages/historical-mortgage-rates/,Today’s mortgage rates aren’t all that different from the rates of years past. Here’s how they compare.,"Aug 08, 2024"
What are reserves for a mortgage?,mortgages,https://www.bankrate.com//mortgages/cash-reserves-for-mortgage/,They’re a financial cushion to meet your monthly payments. But what makes them mandatory?,"Sep 13, 2024"
Mortgage brokers: What they do and how they help homebuyers,mortgages,https://www.bankrate.com//mortgages/mortgage-broker/,This home-financing pro could help you find that perfect loan.,"Sep 13, 2024"
Closing costs: What are they and how much are they?,mortgages,https://www.bankrate.com//mortgages/what-are-closing-costs/,They’re upfront expenses you pay on closing day. And they can mount into the thousands.,"Sep 13, 2024"
When should you refinance your mortgage?,mortgages,https://www.bankrate.com//mortgages/when-to-refinance/,When doing so saves you money — or helps you score some.,"Sep 16, 2024"
What is the APR on a mortgage and how does it work?,mortgages,https://www.bankrate.com//mortgages/what-is-mortgage-apr/,"If you’re shopping for a mortgage, you better know what it means.","Sep 12, 2024"
How much does it cost to refinance a mortgage?,mortgages,https://www.bankrate.com//mortgages/how-much-it-costs-to-refinance/,It isn’t cheap. But what matters more is how fast you can recoup those closing costs.,"Sep 16, 2024"
How to get a VA home loan,mortgages,https://www.bankrate.com//mortgages/getting-a-va-loan/,"Your battle plan for getting a VA loan. A bit lengthy, but well worth the effort.","Sep 13, 2024"
Experts: How Harris and Trump’s plans could impact housing affordability,mortgages,https://www.bankrate.com//mortgages/harris-trump-housing-plans/,"The candidates’ plans could help or hurt housing affordability, experts say.","Sep 09, 2024"
Will Fed rate cuts stop the housing market roller coaster?,mortgages,https://www.bankrate.com//mortgages/will-fed-rate-cuts-fix-housing-market/,Can a Fed rate cut stop the housing market roller coaster?,"Sep 06, 2024"
How to write a letter of explanation for a mortgage,mortgages,https://www.bankrate.com//mortgages/letter-of-explanation-for-mortgage/,"No need to panic, but it’s important to do it right. Your loan may depend on it.","Sep 11, 2024"
Fixed vs. adjustable-rate mortgage (ARM): What’s the difference?,mortgages,https://www.bankrate.com//mortgages/arm-vs-fixed-rate/,"One offers certain, unchanging payments; the other, a chance to pay less interest.","Sep 11, 2024"
Here’s why mortgage rates won’t fall after the Fed cut,mortgages,https://www.bankrate.com//mortgages/will-fed-cut-lower-mortgage-rates/,Today’s mortgage rates already reflect the likelihood of a September Federal Reserve rate cut.,"Sep 12, 2024"
"Millennial homebuyers: Obstacles to homeownership, statistics and tips",mortgages,https://www.bankrate.com//mortgages/millennials-and-homebuying/,Here’s a look at the largest group of homebuyers today.,"Sep 06, 2024"
Investment and rental property statistics 2024,mortgages,https://www.bankrate.com//mortgages/investment-property-statistics/,Here are the latest investment and rental property statistics.,"Aug 22, 2024"
Reasons not to tap your home equity,mortgages,https://www.bankrate.com//home-equity/things-to-consider-before-using-home-equity/,"For one thing, you could lose your home if things go south.","Aug 22, 2024"
What is an interest-only HELOC and how does it work?,mortgages,https://www.bankrate.com//home-equity/what-is-an-interest-only-heloc/,It lets you make minimal monthly repayments for a while. But it could shock you at the end.,"Aug 26, 2024"
Refinancing your ARM into a fixed-rate mortgage,mortgages,https://www.bankrate.com//mortgages/should-you-refinance-arm-into-fixed-rate-mortgage/,It all depends on how interest rates are trending and how your financials are looking.,"Aug 22, 2024"
Homebuyer education courses: What are they and should you take one?,mortgages,https://www.bankrate.com//mortgages/first-time-homebuyer-class/,"If you’re a first-time homebuyer, a little learning never hurts.","Aug 27, 2024"
Cash-out refinance for energy-efficient improvements,mortgages,https://www.bankrate.com//mortgages/cash-out-refinancing-energy-efficient-improvements/,"It could be a shrewd strategy, as long as the costs suit your budget and timeline.","Aug 22, 2024"
"No rush to refinance your mortgage just yet, experts say",mortgages,https://www.bankrate.com//mortgages/refinance-now-or-wait/,"Mortgage rates have fallen, but the imminent Fed cut could make them even more favorable for refinancers.","Aug 21, 2024"
How to get equity out of your home — and how to choose the best way,mortgages,https://www.bankrate.com//home-equity/how-much-equity-can-you-cash-out-of-home/,"Your home isn’t a piggy bank, but there are wise ways to tap your ownership stake for cash.","Aug 22, 2024"
VA Certificate of Eligibility: What it is and how to get one,mortgages,https://www.bankrate.com//mortgages/va-loan-certificate-of-eligibility/,Don’t skip this crucial step on your road to homeownership.,"Aug 29, 2024"
Does refinancing a mortgage affect your property taxes?,mortgages,https://www.bankrate.com//mortgages/refinancing-and-property-taxes/,"No, there won’t be an immediate impact. But there are some things to watch out for.","Aug 28, 2024"
How to get preapproved for a mortgage,mortgages,https://www.bankrate.com//mortgages/pre-approval/,"If you’re serious about buying a home, it’s the first thing you should do.","Aug 27, 2024"
HomeReady mortgage guide,mortgages,https://www.bankrate.com//mortgages/homeready/,It can be a route to homeownership for those with lower incomes.,"Aug 27, 2024"
How to get a home equity loan with bad credit,mortgages,https://www.bankrate.com//home-equity/home-equity-loan-bad-credit/,"Yes, you can get financing, even if you’re not the most creditworthy candidate.","Aug 28, 2024"
Blanket mortgage: How it works and who should use it,mortgages,https://www.bankrate.com//mortgages/blanket-mortgage/,It covers a particular type of borrower or investor. Newbies needn’t apply.,"Aug 29, 2024"
Assumable mortgage: What is it and how does it work?,mortgages,https://www.bankrate.com//mortgages/assumable-mortgages/,It could be a smart move if interest rates are high. But will the lender allow you to?,"Aug 29, 2024"
Mortgage lenders vs. banks: Which is best for you?,mortgages,https://www.bankrate.com//mortgages/bank-vs-mortgage-lender/,"It depends on your personal situation, goals and preferences.","Aug 13, 2024"
What are non-conforming loans?,mortgages,https://www.bankrate.com//mortgages/non-conforming-loans-guide/,Non-conforming loans aren’t all risk. Here’s what to know.,"Aug 13, 2024"
What is a prepayment penalty?,mortgages,https://www.bankrate.com//mortgages/prepayment-penalty/,It’s basically a fee to stop you from settling your mortgage early.,"Aug 14, 2024"
Portfolio mortgages: What they are and how they work,mortgages,https://www.bankrate.com//mortgages/portfolio-loan/,"If you don’t meet traditional loan criteria, they could be the answer. Beware the fine print, though.","Aug 09, 2024"
Mortgage loan originators: What are they and what do they do?,mortgages,https://www.bankrate.com//mortgages/mortgage-loan-originator/,It’s your administrative rep during the mortgage application process. But don’t rely on them to approve you.,"Aug 13, 2024"
Guide to first-time homebuyer grants,mortgages,https://www.bankrate.com//mortgages/first-time-homebuyer-grants/,There’s one key fact that separates first-time homebuyer grants from other forms of help.,"Aug 13, 2024"
Pros and cons of a home equity line of credit (HELOC),mortgages,https://www.bankrate.com//home-equity/pros-cons-of-home-equity-lines/,"A HELOC has low interest rates, but it requires you to use your home as collateral.","Aug 14, 2024"
What is a 7/1 adjustable-rate mortgage (ARM)?,mortgages,https://www.bankrate.com//mortgages/what-is-a-7-1-arm/,"It could be a good deal, depending on how you think interest rates are trending.","Aug 15, 2024"
Reverse mortgage: What it is and how it works,mortgages,https://www.bankrate.com//mortgages/reverse-mortgage-guide/,"These home equity loans can be a source of cash for seniors, albeit a costly one.","Jul 24, 2024"
Mortgage recasting: What it is and how it works,mortgages,https://www.bankrate.com//mortgages/what-is-mortgage-recasting-and-why-do-it/,You pay a lump sum now to cut future monthly payments. But there are drawbacks.,"Jul 24, 2024"
Should you add a co-borrower to your mortgage?,mortgages,https://www.bankrate.com//mortgages/should-you-add-a-co-borrower-to-your-mortgage/,"It can boost your chances of being approved, but it may mean sharing ownership too.","Jul 30, 2024"
8 ways to refinance a mortgage with bad credit,mortgages,https://www.bankrate.com//mortgages/home-refinance-options-for-people-with-bad-credit/,Borrowers with poor credit can still nail down home loan refinancing. Here’s how.,"Jul 26, 2024"
Does mortgage prequalification affect your credit score?,mortgages,https://www.bankrate.com//mortgages/pros-and-cons-of-prequalification/,Doubtful — but homebuyers should know the pros and cons of prequalification anyway.,"Jul 30, 2024"
"What’s the ideal mortgage rate to buy a home? Older, younger generations diverge",mortgages,https://www.bankrate.com//mortgages/ideal-mortgage-rates-by-generation/,What’s the ideal mortgage rate? It depends who you ask.,"Jul 25, 2024"
More than half of homeowners want mortgage rates under 6%. Will a Fed cut help?,mortgages,https://www.bankrate.com//mortgages/will-fed-cut-lower-mortgage-rates-enough/,The Federal Reserve is poised to cut rates in September. Will it be enough to entice homebuyers?,"Jul 31, 2024"
Which states have the richest homeowners?,mortgages,https://www.bankrate.com//home-equity/states-with-most-home-equity/,"In the home equity sweepstakes, who’s on top and who’s on bottom?","Jul 19, 2024"
ARM loan requirements in 2024,mortgages,https://www.bankrate.com//mortgages/arm-loan-requirements/,"They’re similar to fixed-rate loans, but beware the fluctuating interest rate.","Jul 19, 2024"
Should you use a HELOC to buy property overseas?,mortgages,https://www.bankrate.com//home-equity/use-heloc-to-buy-property-overseas/,"It could be a shrewd strategy, but bear in mind the risks of tapping home equity.","Jul 19, 2024"
Survey: 47% of homeowners would need mortgage rates under 5% to be comfortable buying a home this year,mortgages,https://www.bankrate.com//mortgages/mortgage-rates-sentiment-survey/,Almost half of homeowners in a new Bankrate survey say they’d need mortgage rates to fall below 5 percent in order to feel comfortable buying a home this year.,"Jul 24, 2024"
How to buy a house with low income,mortgages,https://www.bankrate.com//mortgages/how-to-buy-a-house-with-low-income/,"Yes, you can buy a house with a low income.","Jul 24, 2024"
Credit union vs. bank mortgage: How to choose,mortgages,https://www.bankrate.com//mortgages/get-mortgage-from-credit-union/,Here are the pros and cons of getting a mortgage from a credit union.,"Jul 22, 2024"
How to shop for a HELOC: 10 ways to get the best HELOC rate,mortgages,https://www.bankrate.com//home-equity/get-the-best-heloc-rate/,What to watch for to get a top offer on a home equity line of credit.,"Jul 23, 2024"
3 percent down mortgages: A guide to your options,mortgages,https://www.bankrate.com//mortgages/3-percent-down-mortgage-guide/,You don’t have to come up with 20% in cash. But paying less now can cost you later.,"Jul 22, 2024"
Convertible ARM loans: What they are and how they work,mortgages,https://www.bankrate.com//mortgages/conversion-clause/,This type of mortgage might save you money in the long run.,"Jun 27, 2024"
What is a bridge loan and how does it work?,mortgages,https://www.bankrate.com//mortgages/bridge-loan/,"Bridge loans can help borrowers move from one home to the next, but do have potential downsides.","Jun 28, 2024"
Advantages and disadvantages of having a mortgage,mortgages,https://www.bankrate.com//mortgages/mortgage-pros-and-cons/,To mortgage or not to mortgage? Here’s what to consider.,"Jun 27, 2024"
VA loan limits for 2024,mortgages,https://www.bankrate.com//mortgages/va-loan-limits/,"They are largely gone, but that doesn’t necessarily mean you can get any size VA loan you want.","Jul 01, 2024"
Financial freedom feels far away for the 30-year-olds moving home to save money,mortgages,https://www.bankrate.com//mortgages/millennials-with-debt-moving-in-with-parents/,Today’s millennials are moving home in an attempt to save money and pay off debt.,"Jun 27, 2024"
What is a broker price opinion (BPO)?,mortgages,https://www.bankrate.com//mortgages/broker-price-opinion/,It’s what helps put the price tag on a home up for sale.,"Jul 01, 2024"
"Why your mortgage gets sold, and what you can do about it",mortgages,https://www.bankrate.com//mortgages/what-happens-when-your-mortgage-gets-sold/,The first step is simple: Don’t obsess. It happens all the time.,"Jun 28, 2024"
What is conditional approval in a mortgage application?,mortgages,https://www.bankrate.com//mortgages/conditional-approval/,"It means you almost have got that mortgage, but must do a little more to clinch the deal.","Jun 28, 2024"
Average down payment on a house,mortgages,https://www.bankrate.com//mortgages/average-down-payment/,It might not be as much as you think.,"Jul 09, 2024"
10/1 or 10/6 ARM vs. 30-year fixed-rate mortgage,mortgages,https://www.bankrate.com//mortgages/101-arm-vs-30-year-fixed-mortgage/,Plan to stay in your house for 10 years or less? A 10/1 ARM may be a good choice.,"Jul 09, 2024"
Adjustable-rate mortgages: What they are and how they work,mortgages,https://www.bankrate.com//mortgages/basics-of-adjustable-rate-mortgages/,It’s a mortgage with a fluctuating interest rate. Which can be to your advantage — or not.,"Jul 08, 2024"
Owner financing: What it is and how it works,mortgages,https://www.bankrate.com//mortgages/owner-financing/,The seller playing lender can help buyers. But there are risks on both sides.,"Jul 08, 2024"
Guide to closing on a house: What to expect during the closing process,mortgages,https://www.bankrate.com//mortgages/understanding-the-closing-process/,Don’t get tripped up at the finish line when you buy a house.,"Jul 09, 2024"
Home equity loan or HELOC vs. reverse mortgage: Which is right for you?,mortgages,https://www.bankrate.com//home-equity/home-equity-loan-heloc-vs-reverse-mortgage/,"They all let you tap your ownership stake, but they differ significantly in a lot of ways.","Jul 09, 2024"
VA home loan requirements for 2024,mortgages,https://www.bankrate.com//mortgages/va-loan-requirements/,VA home loans come with generous terms. But don’t assume the lender is giving you a free pass.,"Jul 08, 2024"
Mortgagor vs. mortgagee: What’s the difference?,mortgages,https://www.bankrate.com//mortgages/mortgagor-vs-mortgagee/,"They sound almost the same, but actually refer to parties on the opposite ends of a home loan.","Jul 15, 2024"
FHA 203(k) loans: What they are and how they work,mortgages,https://www.bankrate.com//mortgages/what-is-203k-loan/,This type of mortgage lets you pay for a home and renovations with a single loan.,"Jul 12, 2024"
What is a balloon mortgage?,mortgages,https://www.bankrate.com//mortgages/what-is-a-balloon-mortgage/,"Beware, lest it blow up in your face.","Jul 15, 2024"
