title,tag,link,description,date
Income requirements to qualify for a mortgage,mortgages,https://www.bankrate.com//mortgages/proving-income-to-land-a-mortgage/,"It’s not just if you have enough coming in, but how much you have going out.","May 10, 2024"
What is a 3/1 adjustable-rate mortgage (ARM)?,mortgages,https://www.bankrate.com//mortgages/what-is-a-3-1-arm/,Want the lowest-possible interest rate? This mortgage delivers — for a few brief years.,"May 09, 2024"
Average monthly mortgage payment,mortgages,https://www.bankrate.com//mortgages/average-monthly-mortgage-payment/,"If you get a mortgage, you’ll need to make a monthly loan payment. Here’s a look at the national average.","May 08, 2024"
What is a non-QM loan? The lowdown on non-qualifying mortgages,mortgages,https://www.bankrate.com//mortgages/non-qm-loans/,"It can help the unconventional borrower get a home, but at a high cost — and default risk.","May 07, 2024"
Lender credits: What are they and how do they work,mortgages,https://www.bankrate.com//mortgages/lender-credits/,"It saves costs upfront, but it’s not free money.","May 08, 2024"
Buying a house with cash vs. a mortgage,mortgages,https://www.bankrate.com//mortgages/all-cash-vs-mortgage/,"Paying all-cash saves you money and time, but getting a mortgage has financial benefits too.","May 08, 2024"
Pros and cons of a 15-year mortgage,mortgages,https://www.bankrate.com//mortgages/pros-and-cons-15-year-mortgage/,A 15-year mortgage has a lot of positives. Provided it won’t cost you too much.,"May 09, 2024"
Smart ways to use your home equity for remodeling,mortgages,https://www.bankrate.com//home-equity/home-equity-for-improvement-renovation/,"Should you use your home to enhance your home? It’s tricky, so learn before you leap.","May 07, 2024"
Understanding the mortgage underwriting process,mortgages,https://www.bankrate.com//mortgages/steps-in-underwriting-process/,What to expect from start to finish when lenders evaluate you for a home loan.,"May 24, 2024"
"FHA vs. VA loans: What’s the difference, and which is better for you?",mortgages,https://www.bankrate.com//mortgages/va-fha-comparison/,"Two government-backed mortgage programs, each with unique benefits","May 24, 2024"
What is mortgage amortization?,mortgages,https://www.bankrate.com//mortgages/what-is-mortgage-amortization/,Using Bankrate’s calculator can help you see the outcomes for different scenarios.,"May 24, 2024"
Conforming loans: What they are and how they work,mortgages,https://www.bankrate.com//mortgages/conforming-loan/,It’s a mortgage has to adhere to certain standards — to protect both you and the lender.,"May 24, 2024"
How do you pay back a reverse mortgage?,mortgages,https://www.bankrate.com//mortgages/pay-back-reverse-mortgage/,"How do you pay back a reverse mortgage, and when is it necessary?","May 24, 2024"
"Right of rescission: Canceling a HELOC, home equity loan or refinance",mortgages,https://www.bankrate.com//mortgages/right-of-rescission/,"If you’re second-guessing your refi or home equity loan, you could have a way out.","May 24, 2024"
Wraparound mortgage: What it is and how it can help buyers and sellers,mortgages,https://www.bankrate.com//mortgages/what-is-a-wraparound-mortgage/,The home seller becomes your lender In this obscure financing option.,"May 24, 2024"
What is the Home Ownership and Equity Protection Act (HOEPA)?,mortgages,https://www.bankrate.com//mortgages/home-ownership-equity-protection-act/,"It protects you from predatory practices by mortgage lenders, among other things.","May 24, 2024"
How to prepare for FHA appraisal requirements,mortgages,https://www.bankrate.com//mortgages/fha-appraisal-requirements/,"Learn about this key step in the FHA loan process, a cross between appraisal and home inspection.","Apr 19, 2024"
What is an energy-efficient mortgage (EEM)and how can it save you money?,mortgages,https://www.bankrate.com//mortgages/energy-efficient-mortgage/,You can get an EEM through many of the same lenders that offer mortgages.,"Apr 19, 2024"
I’m well into paying off my mortgage. Should I still refinance?,mortgages,https://www.bankrate.com//mortgages/refinancing-a-nearly-paid-mortgage/,You need to crunch numbers to see if a refi makes sense.,"Apr 19, 2024"
How to get a low-cost mortgage refinance,mortgages,https://www.bankrate.com//mortgages/low-cost-refinance/,"But be careful, lest a strategy end up costing you more in the long run.","Apr 23, 2024"
Down payment assistance: How it works and how to get it,mortgages,https://www.bankrate.com//mortgages/down-payment-assistance/,Here’s how to find down payment assistance and what you’ll need to qualify.,"Apr 19, 2024"
How to avoid mortgage rate lock extension fees,mortgages,https://www.bankrate.com//mortgages/avoid-mortgage-rate-lock-extension-fees/,Protect yourself from being charged over a loan delay that wasn’t your fault.,"Apr 19, 2024"
What is a loan-to-value ratio?,mortgages,https://www.bankrate.com//mortgages/what-is-loan-to-value-ratio-ltv/,"It’s a comparison calculation that’ll determine if you’ll get a loan, and the interest rate you’ll pay.","Apr 19, 2024"
VA loans: What they are and how they work,mortgages,https://www.bankrate.com//mortgages/understanding-va-loans/,Learn the essentials of this popular mortgage before you apply.,"Apr 19, 2024"
VA cash-out refinance: How it works and what to consider,mortgages,https://www.bankrate.com//mortgages/va-cash-out-refinance/,"A VA cash-out refinance can help you save money, but it isn’t free.","Apr 30, 2024"
Second home vs. investment property: Different mortgage requirements and rules,mortgages,https://www.bankrate.com//mortgages/second-home-vs-investment-property/,Earning some money from your property doesn’t automatically make it an investment.,"Apr 30, 2024"
Mortgage rate forecast for May 2024: No break for homebuyers,mortgages,https://www.bankrate.com//mortgages/mortgage-rate-forecast-for-may-2024-no-break-for-homebuyers/,Homebuyers out on the spring hunt won’t see much relief from higher mortgage rates.,"May 01, 2024"
FHA cash-out refinance guide,mortgages,https://www.bankrate.com//mortgages/fha-cash-out-refinancing/,Here’s how an FHA cash-out refinance works.,"Apr 30, 2024"
Graduated payment mortgages: What are they and how do they work?,mortgages,https://www.bankrate.com//mortgages/graduated-payment-mortgage/,"Imagine a mortgage with a fixed interest rate, but a monthly payment that varies.","Apr 30, 2024"
VA loans vs. conventional loans: What’s the difference?,mortgages,https://www.bankrate.com//mortgages/va-vs-conventional-loan/,"If you qualify for both a VA and conventional loan, consider the pros and cons of each.","Apr 30, 2024"
Portfolio mortgage lenders: What are they and how do you find one?,mortgages,https://www.bankrate.com//mortgages/what-are-portfolio-mortgage-lenders/,"These lenders keep the mortgages they underwrite, so they may lend when others won’t.","Apr 30, 2024"
Mortgage seasoning: What is it and what are the requirements?,mortgages,https://www.bankrate.com//mortgages/seasoning-requirements/,"It means you need to have money on hand to get a mortgage. And like fine wine — the longer, the better.","May 01, 2024"
What are cash-out refinance tax implications?,mortgages,https://www.bankrate.com//mortgages/cash-out-refinance-tax-implications/,Cash-out refinances have implications at tax time.,"Apr 26, 2024"
Predatory lending: What it is and how to avoid it,mortgages,https://www.bankrate.com//mortgages/predatory-lending-what-it-is-and-how-to-avoid-it/,Predatory lenders employ many tactics. Here’s what to watch for.,"Apr 30, 2024"
How often can you refinance your home?,mortgages,https://www.bankrate.com//mortgages/how-many-times-can-you-refinance/,"More than once, certainly. But making a habit of it gets costly.","Apr 29, 2024"
How to find the best VA lender: A step-by-step guide,mortgages,https://www.bankrate.com//mortgages/how-to-find-best-va-lender/,"Many offer, but few are chosen: How to evaluate a VA lender’s service record.","Apr 29, 2024"
How rising home values helped lower my mortgage bill,mortgages,https://www.bankrate.com//mortgages/rising-home-values-helped-lower-my-mortgage-bill/,Higher home values helped lower this Bankrate writer’s mortgage costs.,"Apr 29, 2024"
Piggyback loans: What they are and how they work,mortgages,https://www.bankrate.com//mortgages/piggyback-loan/,"It requires not one, but two mortgages. But it can get you closer to that dream home.","Apr 29, 2024"
Joint mortgages: What are they and should you get one?,mortgages,https://www.bankrate.com//mortgages/joint-mortgage/,It can get you that home if your qualifications are shaky. But it doesn’t necessarily mean joint ownership.,"Apr 29, 2024"
How are mortgage rates determined?,mortgages,https://www.bankrate.com//mortgages/how-interest-rates-are-set/,Understanding mortgage rate movements could save you money.,"Apr 29, 2024"
How many VA loans can you have?,mortgages,https://www.bankrate.com//mortgages/second-va-loan/,The VA mortgage program isn’t a one-time thing. Here’s how to get another helping.,"Apr 17, 2024"
What is mortgage insurance?,mortgages,https://www.bankrate.com//mortgages/what-is-mortgage-insurance/,"While mortgage insurance primarily benefits the lender, it does serve a purpose for the borrower.","Apr 18, 2024"
Prequalified vs. preapproved: What’s the difference?,mortgages,https://www.bankrate.com//mortgages/preapproved-vs-prequalified/,"They sound similar, but only one assures home sellers you’re a serious buyer.","Apr 15, 2024"
What to do when your mortgage application gets denied,mortgages,https://www.bankrate.com//mortgages/what-to-do-if-mortgage-application-is-denied/,"First, you cry. Then you fix the issue. Here’s how.","Apr 15, 2024"
Mortgage forbearance: What is it and how does it work?,mortgages,https://www.bankrate.com//mortgages/everything-you-should-know-about-mortgage-forbearance/,Answers to borrowers most common mortgage forbearance questions,"Apr 18, 2024"
Mortgage loan modification: What it is and how to get one,mortgages,https://www.bankrate.com//mortgages/loan-modification-strategy/,"If you can’t pay your mortgage, you may be able to have it modified. Here’s what to look for.","Apr 16, 2024"
"In debate over mortgage ‘junk’ fees, lenders and regulators disagree",mortgages,https://www.bankrate.com//mortgages/mortgage-junk-fees/,The government is stepping up scrutiny of “junk” fees — but are they really junk?,"Apr 16, 2024"
Home equity loan or HELOC vs. cash-out mortgage refinance,mortgages,https://www.bankrate.com//home-equity/home-equity-loan-heloc-or-cash-out-refi/,Knowing the differences among equity loans will help you make the right choice.,"Apr 16, 2024"
Private mortgage insurance (PMI): What it is and how it works,mortgages,https://www.bankrate.com//mortgages/basics-of-private-mortgage-insurance-pmi/,Hard to avoid it if your down payment is low. But must you pay this extra fee forever?,"Apr 10, 2024"
Getting a mortgage while on maternity leave,mortgages,https://www.bankrate.com//mortgages/maternity-leave-mortgage-approval/,"It’s doable, but your lender may put you through some extra hoops. Here’s what’s allowed.","Apr 09, 2024"
Wholesale mortgage lenders: What they are and how they work,mortgages,https://www.bankrate.com//mortgages/wholesale-lender/,"You may not recognize their name, but they might have a better deal for you.","Apr 11, 2024"
VA loan down payment: Definition and requirements,mortgages,https://www.bankrate.com//mortgages/va-loan-down-payment/,Most VA loan borrowers don’t have to make a down payment. Here’s how to decide whether you should.,"Apr 10, 2024"
How to lower your mortgage payment,mortgages,https://www.bankrate.com//mortgages/how-to-lower-mortgage-payments/,"Yes, you can pay less each month. Not all methods are worth the time or upfront expense, though.","Apr 10, 2024"
What is a savings and loan association (S&L)?,mortgages,https://www.bankrate.com//mortgages/savings-and-loan-associations/,It’s a financial institution that focuses primarily on mortgages and savings accounts.,"Apr 09, 2024"
What is a closing disclosure?,mortgages,https://www.bankrate.com//mortgages/closing-disclosure/,The lender must provide final details of your mortgage on the closing disclosure.,"Apr 09, 2024"
Loan modification vs. refinance: Which option is best for you?,mortgages,https://www.bankrate.com//mortgages/loan-modification-or-refinance-whats-better-for-borrowers/,"The bottom line: You can choose to refinance, but you’re forced into a loan modification.","Apr 10, 2024"
Good Neighbor Next Door program: What it is and how to apply,mortgages,https://www.bankrate.com//mortgages/good-neighbor-next-door/,It offers a way to buy a home for half off the list price. But there is a catch or two.,"Apr 05, 2024"
Getting a mortgage after bankruptcy: What you need to know,mortgages,https://www.bankrate.com//mortgages/how-to-get-a-mortgage-after-bankruptcy/,"It’s not easy, but if you are prepared for extra hurdles, it can happen.","Apr 04, 2024"
What happens if your mortgage company goes bankrupt?,mortgages,https://www.bankrate.com//mortgages/what-happens-to-mortgage-if-lender-goes-bankrupt/,"It’s usually not a problem — but it doesn’t get you out of payments, either.","Apr 03, 2024"
What is the draw period on a HELOC and how does it work?,mortgages,https://www.bankrate.com//home-equity/heloc-refinance-draw-period-ends/,"It’s the fun part, when you get your money. But you have to be ready when it ends.","Apr 04, 2024"
What is a jumbo loan and when do you need one?,mortgages,https://www.bankrate.com//mortgages/what-is-jumbo-mortgage/,"As the name implies, it’s a loan for a lot more money. But it has higher requirements too.","Apr 02, 2024"
The best home loan: how to shop for and compare mortgage offers,mortgages,https://www.bankrate.com//mortgages/how-to-compare-mortgage-offers/,"By comparing mortgage offers, you can potentially save thousands.","Apr 05, 2024"
FHA closing costs: What they are and how much you’ll pay,mortgages,https://www.bankrate.com//mortgages/fha-closing-costs/,"Like other types of mortgages, FHA loans come with closing costs. Here’s a breakdown of what to expect.","Apr 04, 2024"
Guide to 40-year mortgages: What are they and should you get one?,mortgages,https://www.bankrate.com//mortgages/what-are-40-year-mortgages/,"A 40-year mortgage comes with lower monthly payments, but higher interest costs.","Apr 03, 2024"
Types of mortgage refinance: How to choose,mortgages,https://www.bankrate.com//mortgages/choose-the-right-kind-of-refinance/,"There are many mortgage refinance options, and more than one might suit your needs. Here’s how to choose the best one.","Mar 26, 2024"
VA loan spouse requirements,mortgages,https://www.bankrate.com//mortgages/va-loan-spouse-requirements/,Hitched to a member of a military? You can benefit from these generous mortgages too.,"Mar 26, 2024"
VA renovation loans: Buying and fixing up a home with one loan,mortgages,https://www.bankrate.com//mortgages/va-renovation-loans/,A VA rehab loan can help you make upgrades — but only to essential systems.,"Mar 26, 2024"
Underwater mortgage: What it is and what to do,mortgages,https://www.bankrate.com//mortgages/underwater-mortgage-what-to-do/,Underwater mortgages can occur during an economic downturn when home values fall.,"Mar 26, 2024"
Mortgage protection insurance (MPI) vs. life insurance,mortgages,https://www.bankrate.com//mortgages/mortgage-protection-insurance-vs-life-insurance/,It’s important to understand how this policy contrasts with other insurance.,"Mar 26, 2024"
What is per diem interest? How it works and why it’s charged,mortgages,https://www.bankrate.com//mortgages/per-diem-interest/,You may owe interest on your mortgage right away. Here’s why and how much.,"Mar 26, 2024"
What is mortgage loan origination?,mortgages,https://www.bankrate.com//mortgages/home-loan-origination-process/,It’s a mouthful that actually has a simple meaning: the creation of your loan.,"Mar 26, 2024"
How to read and compare mortgage loan estimates,mortgages,https://www.bankrate.com//mortgages/how-to-compare-loan-estimates/,A loan estimate is just that: an estimate. Here’s what you need to know.,"Mar 26, 2024"
What is correspondent lending?,mortgages,https://www.bankrate.com//mortgages/correspondent-lending/,Correspondent lending has its pros and cons.,"Apr 23, 2024"
Lender-paid mortgage insurance (LPMI): What is it and how does it work?,mortgages,https://www.bankrate.com//mortgages/lender-paid-mortgage-insurance/,"LPMI allows you to forgo mortgage insurance, but you’ll have to stomach a higher interest rate.","Apr 26, 2024"
What is an alienation clause?,mortgages,https://www.bankrate.com//mortgages/alienation-clause/,It’s the reason your mortgage lender gets paid back first from your home sale’s proceeds.,"Apr 24, 2024"
No-doc mortgage: What is it and can you still get one?,mortgages,https://www.bankrate.com//mortgages/no-doc-mortgage/,"There are some no doc mortgages, but you won’t find them widely advertised.","Apr 24, 2024"
How many people can be on a mortgage?,mortgages,https://www.bankrate.com//mortgages/how-many-names-can-be-on-a-mortgage/,"Up to four, usually. But it’s complicated.","Apr 25, 2024"
How does mortgage interest work?,mortgages,https://www.bankrate.com//mortgages/what-is-a-mortgage-interest-rate/,"Everything you always wanted to know, from how it’s calculated to how to get a good rate.","Apr 26, 2024"
What is a short sale?,mortgages,https://www.bankrate.com//mortgages/short-sale/,It can get a homeowner out of a jam and a buyer a good deal. But it’s tough to pull off.,"Apr 24, 2024"
What credit score is needed to refinance your mortgage?,mortgages,https://www.bankrate.com//mortgages/credit-score-to-refinance/,"If you have bad credit, you need to find ways to compensate for the additional risk.","Apr 26, 2024"
Cash out refi vs. home equity loan: What you need to know,mortgages,https://www.bankrate.com//home-equity/refinance-vs-home-equity-loans/,Both mean ready money — but their pros and cons vary quite a bit.,"Apr 11, 2024"
HFA loans: Everything you need to know,mortgages,https://www.bankrate.com//mortgages/hfa-loans/,HFA loans are designed to make homeownership more affordable.,"Apr 15, 2024"
What happens to your mortgage when you die?,mortgages,https://www.bankrate.com//mortgages/what-happens-to-mortgage-when-you-die/,"When you pass away, your mortgage doesn’t suddenly disappear.","Apr 12, 2024"
How to refinance a rental property,mortgages,https://www.bankrate.com//mortgages/how-to-refinance-a-house-renting-out/,"No, it’s not exactly the same as refinancing your home’s mortgage.","Apr 11, 2024"
Physician mortgage loans: A mortgage option for doctors,mortgages,https://www.bankrate.com//mortgages/physician-mortgage-loans/,They’re a good deal for aspiring homeowners. But you still might want to get a second opinion.,"Apr 12, 2024"
What is a subprime mortgage?,mortgages,https://www.bankrate.com//mortgages/what-is-a-subprime-mortgage/,"While subprime mortgages exist today, they are subject to more oversight.","Apr 15, 2024"
Refinancing to a 15-year mortgage: What to consider,mortgages,https://www.bankrate.com//mortgages/refinancing-into-a-15-year-mortgage/,"You can cut your total mortgage interest in half, but there’s one big catch.","Apr 11, 2024"
What not to do before closing on a house,mortgages,https://www.bankrate.com//mortgages/avoid-mortgage-closing-missteps/,How to navigate the time between when you apply for a mortgage and when it closes.,"Apr 11, 2024"
How much flood insurance is required by mortgage lenders?,mortgages,https://www.bankrate.com//mortgages/how-much-flood-insurance-do-i-need/,"If you need a mortgage for a home in a flood zone, your lender will likely require you to purchase flood insurance.","Mar 29, 2024"
How a mortgage credit certificate (MCC) lowers the cost of borrowing,mortgages,https://www.bankrate.com//mortgages/mortgage-credit-certificate/,Mortgage credit certificates aim to make owning a home a more affordable reality.,"Mar 27, 2024"
How to get the best refinance rate on your mortgage,mortgages,https://www.bankrate.com//mortgages/get-the-best-refinance-rate/,"It takes a bit of strategy. Here’s what you need to know, in seven handy tips.","Mar 28, 2024"
FHA construction loan: What it is and how to get one,mortgages,https://www.bankrate.com//mortgages/fha-construction-loans/,They can help you build or renovate a home on easier terms. But they can be a hassle.,"Apr 01, 2024"
How to get a mortgage for a vacation home,mortgages,https://www.bankrate.com//mortgages/how-to-buy-a-vacation-home/,"It can be fun, but can you afford it?","Mar 27, 2024"
What is loss mitigation?,mortgages,https://www.bankrate.com//mortgages/loss-mitigation/,Here’s what to know about loss mitigation and mortgage relief.,"Mar 28, 2024"
"What is a VA construction loan, and should you use it to build a home?",mortgages,https://www.bankrate.com//mortgages/va-construction-loan/,Here’s what you need to know about building a home with a VA loan.,"Mar 29, 2024"
What are APR fees on a mortgage?,mortgages,https://www.bankrate.com//mortgages/apr-fees/,"The APR on your mortgage typically includes some, but not all, fees.","Apr 01, 2024"
Idaho first-time homebuyer assistance programs,mortgages,https://www.bankrate.com//mortgages/idaho-first-time-homebuyer-assistance-programs/,"If you’re a first-time homebuyer in Idaho, help is available.","Feb 21, 2024"
Maryland first-time homebuyer assistance programs,mortgages,https://www.bankrate.com//mortgages/maryland-first-time-homebuyer-assistance-programs/,"If you’re a first-time homebuyer in Maryland, help is available.","Feb 14, 2024"
Should you refinance with the same lender?,mortgages,https://www.bankrate.com//mortgages/refinance-with-your-current-lender/,Find out if your lender can offer you a better deal.,"Feb 14, 2024"
Iowa first-time homebuyer assistance programs,mortgages,https://www.bankrate.com//mortgages/iowa-first-time-homebuyer-assistance-programs/,"If you’re a first-time homebuyer in Iowa, help is available.","Feb 16, 2024"
Arkansas first-time homebuyer assistance programs,mortgages,https://www.bankrate.com//mortgages/arkansas-first-time-homebuyer-assistance-programs/,"If you’re a first-time homebuyer in Arkansas, help is available.","Feb 16, 2024"
Bank-owned properties: What are they and where can I find them?,mortgages,https://www.bankrate.com//mortgages/bank-owned-properties/,"Bank-owned properties can be a fit for a specific type of homebuyer or investor, but they can be difficult to find in today’s market.","Feb 16, 2024"
Ohio first-time homebuyer assistance programs,mortgages,https://www.bankrate.com//mortgages/ohio-first-time-homebuyer-assistance-programs/,"If you’re a first-time homebuyer in Ohio, help is available.","Feb 15, 2024"
5 things to know before you tackle an expensive outdoor renovation,mortgages,https://www.bankrate.com//home-equity/home-outdoor-renovation-tips/,You don’t need to spend a fortune to create a great outdoor space.,"Feb 21, 2024"
California first-time homebuyer assistance programs,mortgages,https://www.bankrate.com//mortgages/california-first-time-homebuyer-assistance-programs/,Programs available to California first-time buyers that can make homeownership more affordable.,"Jan 31, 2024"
Alabama first-time homebuyer assistance programs,mortgages,https://www.bankrate.com//mortgages/alabama-first-time-homebuyer-assistance-programs/,"If you’re a first-time homebuyer in Alabama, help is available.","Jan 30, 2024"
Oregon first-time homebuyer assistance programs,mortgages,https://www.bankrate.com//mortgages/oregon-first-time-homebuyer-assistance-programs/,"If you’re a first-time homebuyer in Oregon, help is available.","Jan 30, 2024"
Oklahoma first-time homebuyer assistance programs,mortgages,https://www.bankrate.com//mortgages/oklahoma-first-time-homebuyer-assistance-programs/,"If you’re a first-time homebuyer in Oklahoma, help is available.","Jan 31, 2024"
Pennsylvania first-time homebuyer assistance programs,mortgages,https://www.bankrate.com//mortgages/pennsylvania-first-time-homebuyer-assistance-programs/,"If you’re buying your first home in Pennsylvania, help is available.","Jan 30, 2024"
Indiana first-time homebuyer assistance programs,mortgages,https://www.bankrate.com//mortgages/indiana-first-time-homebuyer-assistance-programs/,"If you’re a first-time homebuyer in Indiana, help is available.","Jan 31, 2024"
North Carolina first-time homebuyer assistance programs,mortgages,https://www.bankrate.com//mortgages/north-carolina-first-time-homebuyer-assistance-programs/,"If you’re a first-time homebuyer in North Carolina, help is available.","Jan 31, 2024"
Nebraska first-time homebuyer assistance programs,mortgages,https://www.bankrate.com//mortgages/nebraska-first-time-homebuyer-assistance-programs/,"If you’re a first-time homebuyer in Nebraska, help is available.","Jan 31, 2024"
What is an acceleration clause? And what triggers it?,mortgages,https://www.bankrate.com//mortgages/acceleration-clause/,"Trust us, you don’t want to trigger it. Here’s why.","Mar 25, 2024"
Buying a home after foreclosure,mortgages,https://www.bankrate.com//mortgages/how-to-get-a-mortgage-after-foreclosure/,"Yes, you can own again. But it’ll take patience and a strong financial profile.","Mar 25, 2024"
Guide to downsizing your home,mortgages,https://www.bankrate.com//mortgages/retirees-guide-to-downsizing/,Here’s what to consider before paring down your home.,"Mar 20, 2024"
"Pandemic mortgage forbearance draws to a close, but new relief options emerge",mortgages,https://www.bankrate.com//mortgages/pandemic-mortgage-relief-ending/,"Though the pandemic emergency has ended, mortgage borrowers still have relief options.","Mar 21, 2024"
