title,tag,link,description,date
2024 Virginia conforming and FHA loan limits by county,mortgages,https://www.bankrate.com//mortgages/virginia-jumbo-loan-limits-by-county/,View the current FHA and conforming loan limits for all counties in Virginia.,"Nov 29, 2023"
2024 Idaho conforming and FHA loan limits by county,mortgages,https://www.bankrate.com//mortgages/idaho-jumbo-loan-limits-by-county/,View the current FHA and conforming loan limits for all counties in Idaho.,"Nov 29, 2023"
2024 South Carolina conforming and FHA loan limits by county,mortgages,https://www.bankrate.com//mortgages/south-carolina-jumbo-loan-limits-by-county/,View the current FHA and conforming loan limits for all counties in South Carolina.,"Dec 01, 2023"
2024 Ohio conforming and FHA loan limits by county,mortgages,https://www.bankrate.com//mortgages/ohio-jumbo-loan-limits-by-county/,View the current FHA and conforming loan limits for all counties in Ohio.,"Dec 01, 2023"
2024 Oregon conforming and FHA loan limits by county,mortgages,https://www.bankrate.com//mortgages/oregon-jumbo-loan-limits-by-county/,Buying a home in Oregon? Find the 2024 Oregon conforming and FHA loan limits by county below. Bankrate compiled the conforming loan limits data from Federal Housing Finance Agency and the FHA loan limits [...],"Dec 01, 2023"
2024 North Dakota conforming and FHA loan limits by county,mortgages,https://www.bankrate.com//mortgages/north-dakota-jumbo-loan-limits-by-county/,View the current FHA and conforming loan limits for all counties in North Dakota.,"Dec 01, 2023"
2024 Oklahoma conforming and FHA loan limits by county,mortgages,https://www.bankrate.com//mortgages/oklahoma-jumbo-loan-limits-by-county/,View the current FHA and conforming loan limits for all counties in Oklahoma.,"Dec 01, 2023"
2024 Rhode Island conforming and FHA loan limits by county,mortgages,https://www.bankrate.com//mortgages/rhode-island-jumbo-loan-limits-by-county/,View the current FHA and conforming loan limits for all counties in Rhode Island.,"Dec 01, 2023"
2024 Pennsylvania conforming and FHA loan limits by county,mortgages,https://www.bankrate.com//mortgages/pennsylvania-jumbo-loan-limits-by-county/,View the current FHA and conforming loan limits for all counties in Pennsylvania.,"Dec 01, 2023"
2024 North Carolina conforming and FHA loan limits by county,mortgages,https://www.bankrate.com//mortgages/north-carolina-jumbo-loan-limits-by-county/,View the current FHA and conforming loan limits for all counties in North Carolina.,"Dec 01, 2023"
2024 Arizona conforming and FHA loan limits by county,mortgages,https://www.bankrate.com//mortgages/arizona-jumbo-loan-limits-by-county/,View the current FHA and conforming loan limits for all counties in Arizona.,"Nov 29, 2023"
2024 Alabama conforming and FHA loan limits by county,mortgages,https://www.bankrate.com//mortgages/alabama-jumbo-loan-limits-by-county/,View the current FHA and conforming loan limits for all counties in Alabama.,"Nov 29, 2023"
2024 New Hampshire conforming and FHA loan limits by county,mortgages,https://www.bankrate.com//mortgages/new-hampshire-jumbo-loan-limits-by-county/,View the current FHA and conforming loan limits for all counties in New Hampshire.,"Nov 29, 2023"
2024 Louisiana conforming and FHA loan limits by county,mortgages,https://www.bankrate.com//mortgages/louisiana-jumbo-loan-limits-by-county/,View the current FHA and conforming loan limits for all counties in Louisiana.,"Nov 29, 2023"
2024 Maine conforming and FHA loan limits by county,mortgages,https://www.bankrate.com//mortgages/maine-jumbo-loan-limits-by-county/,View the current FHA and conforming loan limits for all counties in Maine.,"Nov 29, 2023"
2024 Arkansas conforming and FHA loan limits by county,mortgages,https://www.bankrate.com//mortgages/arkansas-jumbo-loan-limits-by-county/,View the current FHA and conforming loan limits for all counties in Arkansas.,"Nov 29, 2023"
2024 Kentucky conforming and FHA loan limits by county,mortgages,https://www.bankrate.com//mortgages/kentucky-jumbo-loan-limits-by-county/,View the current FHA and conforming loan limits for all counties in Kentucky.,"Nov 29, 2023"
2024 Alaska conforming and FHA loan limits by county,mortgages,https://www.bankrate.com//mortgages/alaska-jumbo-loan-limits-by-county/,View the current FHA and conforming loan limits for all counties in Alaska.,"Nov 29, 2023"
How homeowners can avoid post-disaster mortgage scams,mortgages,https://www.bankrate.com//mortgages/avoid-mortgage-scams-post-disaster/,Don’t fall for fraudsters’ phony “mortgage relief” offers.,"Aug 14, 2023"
Rising mortgage rates squeeze housing affordability,mortgages,https://www.bankrate.com//mortgages/coronavirus-hurts-housing-affordability/,"With steep home prices, California metro areas are the nation’s least affordable.","Aug 15, 2023"
Mortgage rate forecast for August 2023: Don’t expect rates to fall far from here,mortgages,https://www.bankrate.com//mortgages/will-mortgage-rates-go-up-in-august-2023/,"Experts hoped for 5 percent mortgage rates by end of year. Now, not so much.","Aug 01, 2023"
U.S. debt downgrade means mortgages just got more expensive,mortgages,https://www.bankrate.com//mortgages/us-debt-downgrade-hits-mortgage-rates/,The downgrade of U.S. debt created one more reason for mortgage rates to stay at a peak.,"Aug 03, 2023"
"Fannie, Freddie step up scrutiny for condo mortgages: Here’s what that means for buyers",mortgages,https://www.bankrate.com//mortgages/post-surfside-condo-mortgage-rules-now-permanent/,Fannie and Freddie have made its post-Surfside condo mortgage rules permanent.,"Aug 08, 2023"
It’s the end of an era for mortgage rates,mortgages,https://www.bankrate.com//mortgages/mortgage-rates-end-of-an-era/,"The last time rates were this high was in 2001, when the median home price was a mere $156,000.","Aug 18, 2023"
"Should you borrow from your builder? A guide to construction loans, homebuilder financing and preferred lenders",mortgages,https://www.bankrate.com//mortgages/home-builder-mortgages-and-construction-loans/,"It could mean discounts and perks, but also higher interest rates and fees.","Aug 18, 2023"
"In a one-two punch for buyers, home prices rise as mortgage rates soar",mortgages,https://www.bankrate.com//mortgages/home-prices-down-but-mortgage-rates-up/,"Home prices keep trending down, but buyers still can’t afford them.","Aug 23, 2023"
2024 Washington conforming and FHA loan limits by county,mortgages,https://www.bankrate.com//mortgages/washington-jumbo-loan-limits-by-county/,View the current FHA and conforming loan limits for all counties in Washington.,"Nov 29, 2023"
2024 Wyoming conforming and FHA loan limits by county,mortgages,https://www.bankrate.com//mortgages/wyoming-jumbo-loan-limits-by-county/,View the current FHA and conforming loan limits for all counties in Wyoming.,"Nov 29, 2023"
2024 Texas conforming and FHA loan limits by county,mortgages,https://www.bankrate.com//mortgages/texas-jumbo-loan-limits-by-county/,View the current FHA and conforming loan limits for all counties in Texas.,"Nov 29, 2023"
2024 California conforming and FHA loan limits by county,mortgages,https://www.bankrate.com//mortgages/california-jumbo-loan-limits-by-county/,View the current FHA and conforming loan limits for all counties in California.,"Nov 29, 2023"
2024 Colorado conforming and FHA loan limits by county,mortgages,https://www.bankrate.com//mortgages/colorado-jumbo-loan-limits-by-county/,View the current FHA and conforming loan limits for all counties in Colorado.,"Nov 29, 2023"
2024 West Virginia conforming and FHA loan limits by county,mortgages,https://www.bankrate.com//mortgages/west-virginia-jumbo-loan-limits-by-county/,View the current FHA and conforming loan limits for all counties in West Virginia.,"Nov 29, 2023"
"2024 Washington, D.C. conforming and FHA loan limits by county",mortgages,https://www.bankrate.com//mortgages/washington-dc-jumbo-loan-limits-by-county/,"View the current FHA and jumbo loan limits for all counties in Washington, D.C.","Nov 29, 2023"
2024 Hawaii conforming and FHA loan limits by county,mortgages,https://www.bankrate.com//mortgages/hawaii-jumbo-loan-limits-by-county/,View the current conforming and FHA loan limits for all counties in Hawaii.,"Nov 29, 2023"
Should you get an adjustable-rate mortgage?,mortgages,https://www.bankrate.com//mortgages/is-an-adjustable-rate-mortgage-right-for-you/,"Although ARMs are buzzy again, the risk hasn’t changed.","Nov 20, 2023"
What is a mortgage origination fee? And do you have to pay it?,mortgages,https://www.bankrate.com//mortgages/origination-fee/,Here’s how much the fee costs and whether you can negotiate it.,"Nov 13, 2023"
Home equity loan vs. mortgage: What’s the difference?,mortgages,https://www.bankrate.com//mortgages/mortgage-vs-home-equity-loan/,There are many options for borrowing money based on a home’s value. Here are two.,"Nov 09, 2023"
Reporting rent payments boosts credit for would-be homebuyers,mortgages,https://www.bankrate.com//mortgages/rent-reporting-services/,A free rent reporting program has helped thousands increase their credit scores.,"Oct 26, 2023"
2024 Wisconsin conforming and FHA loan limits by county,mortgages,https://www.bankrate.com//mortgages/wisconsin-jumbo-loan-limits-by-county/,View the current FHA and conforming loan limits for all counties in Wisconsin.,"Nov 29, 2023"
Predatory lending: What it is and how to avoid it,mortgages,https://www.bankrate.com//mortgages/what-is-predatory-lending/,Predatory lenders employ many tactics. Here’s what to watch for.,"Nov 07, 2023"
Average cost of utility bills,mortgages,https://www.bankrate.com//mortgages/average-utility-bills/,"All-in, utilities might cost more than you think.","Nov 16, 2023"
Conforming loan limits in 2024,mortgages,https://www.bankrate.com//mortgages/conforming-loan-limits/,"For much of the U.S., the divide between conforming loans and jumbo mortgages will be $766,550.","Nov 28, 2023"
2024 Michigan conforming and FHA loan limits by county,mortgages,https://www.bankrate.com//mortgages/michigan-jumbo-loan-limits-by-county/,View the current FHA and conforming loan limits for all counties in Michigan.,"Nov 29, 2023"
2024 Maryland conforming and FHA loan limits by county,mortgages,https://www.bankrate.com//mortgages/maryland-jumbo-loan-limits-by-county/,View the current FHA and conforming loan limits for all counties in Maryland.,"Nov 29, 2023"
2024 Massachusetts conforming and FHA loan limits by county,mortgages,https://www.bankrate.com//mortgages/massachusetts-jumbo-loan-limits-by-county/,View the current FHA and conforming loan limits for all counties in Massachusetts.,"Nov 29, 2023"
2024 Georgia conforming and FHA loan limits by county,mortgages,https://www.bankrate.com//mortgages/georgia-jumbo-loan-limits-by-county/,View the current FHA and conforming loan limits for all counties in Georgia.,"Nov 29, 2023"
2024 Connecticut conforming and FHA loan limits by county,mortgages,https://www.bankrate.com//mortgages/connecticut-jumbo-loan-limits-by-county/,View the current FHA and conforming loan limits for all counties in Connecticut.,"Nov 29, 2023"
2024 Delaware conforming and FHA loan limits by county,mortgages,https://www.bankrate.com//mortgages/delaware-jumbo-loan-limits-by-county/,View the current FHA and conforming loan limits for all counties in Delaware.,"Nov 29, 2023"
2024 Florida conforming and FHA loan limits by county,mortgages,https://www.bankrate.com//mortgages/florida-jumbo-loan-limits-by-county/,View the current conforming and FHA loan limits for all counties in Florida.,"Nov 29, 2023"
2024 Minnesota conforming and FHA loan limits by county,mortgages,https://www.bankrate.com//mortgages/minnesota-jumbo-loan-limits-by-county/,View the current FHA and conforming loan limits for all counties in Minnesota.,"Nov 29, 2023"
Could you pay less for an FHA loan in 2023?,mortgages,https://www.bankrate.com//mortgages/fha-mip-cuts/,The latest FHA balance sheet might help reignite the conversation around lower mortgage insurance premiums.,"Nov 28, 2022"
Fannie Mae aims to help ‘credit invisibles’ land home loans,mortgages,https://www.bankrate.com//mortgages/fannie-mae-new-underwriting-standard/,The mortgage market maker will use bank accounts to determine creditworthiness.,"Jan 06, 2023"
"In tough housing market, mortgage rate buydowns gain momentum",mortgages,https://www.bankrate.com//mortgages/rate-buydowns/,"As home sellers lose their bargaining power in a cooling market, a new option has emerged: Pay for a buyer’s lower rate.","Nov 28, 2022"
"Calendar: What’s driving mortgage rates the week of Nov. 28-Dec. 2, 2022",mortgages,https://www.bankrate.com//mortgages/calendar-jobs-report/,Mortgage market players will closely watch Friday’s jobs report.,"Nov 28, 2022"
"Calendar: What’s driving mortgage rates the week of Nov. 21-25, 2022?",mortgages,https://www.bankrate.com//mortgages/calendar-whats-driving-rates/,A closely watched report about home sales is out this week.,"Nov 21, 2022"
Mortgage rate forecast for January 2023: Rates could yo-yo,mortgages,https://www.bankrate.com//mortgages/will-mortgage-rates-go-up-in-january-2023/,"New year, new rates? It all depends on inflation, the Fed, and if a recession looms.","Jan 01, 2023"
Soaring mortgage rates spur interest in assumable loans,mortgages,https://www.bankrate.com//mortgages/higher-rates-and-assumable-loans/,"With soaring rates squeezing affordability, homebuyers and lenders are taking notice of this oft-overlooked feature.","Nov 07, 2022"
Mortgage rate forecast for December 2022: A celebratory pause?,mortgages,https://www.bankrate.com//mortgages/will-mortgage-rates-go-up-in-december-2022/,This year has been one of the most challenging in which to forecast mortgage rates thanks to unprecedented volatility.,"Dec 01, 2022"
Why the mortgage rate ‘spread’ is suddenly so steep,mortgages,https://www.bankrate.com//mortgages/high-rate-spreads/,"Mortgage rates have shot up this year, but inflation isn’t the only driver.","May 26, 2023"
Why some mortgages are harder to get — and what you can do about it,mortgages,https://www.bankrate.com//mortgages/mortgage-credit-availability/,Mortgage lenders are making it harder to get some types of home loans.,"May 15, 2023"
U.S. mortgage statistics and FAQ,mortgages,https://www.bankrate.com//mortgages/mortgage-statistics/,Current residential mortgage statistics in the U.S.,"May 08, 2023"
Mortgage rate forecast for June 2023: Don’t count on lower rates,mortgages,https://www.bankrate.com//mortgages/will-mortgage-rates-go-up-in-june-2023/,Mortgage rates were supposed to start falling by now. Will they retreat in June?,"Jun 01, 2023"
Leading lenders roll out 1% down payment mortgages,mortgages,https://www.bankrate.com//mortgages/1-percent-down-mortgage/,The nation’s two largest mortgage lenders have rolled out 1% down payment loans. Is there a catch?,"May 25, 2023"
"Mortgage rate deals for week ending April 29, 2023: Top offers from lenders",mortgages,https://www.bankrate.com//mortgages/clicked-on-rates/,"Mortgage rates have been volatile, but bargain hunters can find deals.","Apr 29, 2023"
Where are mortgage rates headed in May 2023?,mortgages,https://www.bankrate.com//mortgages/will-mortgage-rates-go-up-in-may-2023/,Will the long-awaited decline begin this month?,"May 01, 2023"
Mortgage rate forecast for July 2023: Still-strong economy kills hopes for lower rates,mortgages,https://www.bankrate.com//mortgages/will-mortgage-rates-go-up-in-july-2023/,The major factor moving mortgage rates? Inflation — still.,"Jul 01, 2023"
Wells Fargo scales back mortgage lending: How does that affect borrowers?,mortgages,https://www.bankrate.com//mortgages/wells-fargo-scales-back-mortgage-lending/,The banking giant’s retrenchment means less choice for consumers.,"Jan 17, 2023"
Hungry mortgage lenders are dangling deals and discounts,mortgages,https://www.bankrate.com//mortgages/mortgage-lenders-deals-and-discounts/,They’re hoping promos will make you ignore the runup in interest rates.,"Mar 10, 2023"
Forecasting mortgage rates this month is March madness,mortgages,https://www.bankrate.com//mortgages/will-mortgage-rates-go-up-in-march-2023/,"Will they be up, down or sideways? And what does that mean for homebuyers and homesellers?","Mar 01, 2023"
"You better shop around: Comparing mortgage offers nets better deals, Freddie Mac finds",mortgages,https://www.bankrate.com//mortgages/save-on-mortgage-by-comparison-shopping/,"As interest rates rise, so does the disparity in lenders’ quotes.","Feb 28, 2023"
Deed vs title: What’s the difference?,mortgages,https://www.bankrate.com//mortgages/deed-vs-title/,"They both related to property ownership, but one is a physical thing and the other is abstract.","Mar 16, 2023"
"Calendar: What’s driving mortgage rates the week of Jan. 9-13, 2023",mortgages,https://www.bankrate.com//mortgages/monthly-inflation-report/,A widely watched inflation report comes out Thursday.,"Jan 09, 2023"
Mortgage rate forecast for February 2023: Will the groundhog see the shadow of January rates?,mortgages,https://www.bankrate.com//mortgages/will-mortgage-rates-go-up-in-february-2023/,"The consensus is clear — if undramatic: They’ll probably gently drift, like a falling snowflake.","Jan 31, 2023"
Mortgage rates fall after banks fail,mortgages,https://www.bankrate.com//mortgages/mortgage-rates-fall-after-bank-failures/,Rates have taken a tumble this week. But the big question is: Will they bounce back?,"Mar 14, 2023"
Largest mortgage lenders raise jumbo loan cutoff ahead of new 2024 limits,mortgages,https://www.bankrate.com//mortgages/lenders-increase-loan-limits/,The largest mortgage lenders have raised the ceiling on conforming loans.,"Oct 11, 2023"
Mortgage rate forecast October 2023: Higher for longer,mortgages,https://www.bankrate.com//mortgages/will-mortgage-rates-go-up-in-october-2023/,"Don’t expect mortgage rates to depart from the current trend, experts say.","Oct 01, 2023"
No affordable mortgages? This startup could help you take the seller’s loan instead,mortgages,https://www.bankrate.com//mortgages/startup-helps-find-assumable-mortgages/,"What if you could buy a home today, but lock in a mortgage rate from 2021?","Sep 25, 2023"
"Mortgage rates reach 8%, a first since 2000",mortgages,https://www.bankrate.com//mortgages/eight-percent-mortgage-rates/,"The average 30-year fixed mortgage rate touched 8 percent on Oct. 19, according to Bankrate data.","Oct 19, 2023"
Experts: Mortgage rates won’t rise much more — but also won’t go down any time soon,mortgages,https://www.bankrate.com//mortgages/how-high-will-mortgage-rates-go/,The sharp rise in mortgage rates raises a new question: How much higher could they go?,"Oct 20, 2023"
Mortgage rate forecast September 2023: More volatility until the Fed weighs in,mortgages,https://www.bankrate.com//mortgages/will-mortgage-rates-go-up-in-september-2023/,The mortgage rate picture is blurrier than ever.  Where do they go from here?,"Sep 01, 2023"
Mortgage and real estate news: 8% rates on the horizon,mortgages,https://www.bankrate.com//mortgages/mortgage-and-real-estate-news-this-week/,Top mortgage and real estate news of the week,"Oct 07, 2023"
What is a mortgage commitment letter and how does it help buy a home?,mortgages,https://www.bankrate.com//mortgages/mortgage-commitment-letter/,It means you’ve got financing to buy a home — probably. But it’s far from a done deal.,"Oct 13, 2023"
Mortgage lenders now count rent payments as part of credit picture,mortgages,https://www.bankrate.com//mortgages/rent-payments-as-mortgage-qualification/,Close to homeownership but your credit isn’t quite there? A new rule helps renters qualify for mortgages.,"Sep 15, 2022"
How to acquire and establish a rental property,mortgages,https://www.bankrate.com//mortgages/how-to-establish-a-rental-property/,Think you’re ready to pull the trigger on an investment property? Here are a few considerations.,"Sep 12, 2022"
Lenders offer mortgage relief for victims of Hurricane Ian,mortgages,https://www.bankrate.com//mortgages/hurricane-ian-relief/,"Following the storm, Fannie Mae and others have authorized forbearance plans for affected borrowers.","Oct 05, 2022"
Mortgage rate forecast for November 2022: Rates get frostier,mortgages,https://www.bankrate.com//mortgages/will-mortgage-rates-go-up-in-november-2022/,"The holidays are mere weeks away, but there’s not much to celebrate about the mortgage rate climate.","Nov 01, 2022"
How low mortgage rates led to today’s ‘seller’s strike’,mortgages,https://www.bankrate.com//mortgages/should-you-give-up-low-rate/,The ‘seller’s strike’ is real.,"Oct 25, 2022"
Bank of America targets minority homeownership with mortgage program,mortgages,https://www.bankrate.com//mortgages/bank-of-america-zero-down-mortgage-minority-neighborhoods/,One of the nation’s largest banks has launched a mortgage program aimed at first-time homebuyers in Black and Latino neighborhoods.,"Sep 09, 2022"
How much will a house cost by 2030? Predictions and tips to start saving,mortgages,https://www.bankrate.com//mortgages/buying-a-house-in-2030/,The housing market has been superheated. What lies ahead? Here’s what experts think.,"Sep 05, 2022"
Low- and no-down payment minority mortgages still present risks,mortgages,https://www.bankrate.com//mortgages/minority-mortgage-programs/,"As more lenders aim to address the racial housing gap, they offer generous terms. Borrowers still face risks.","Oct 04, 2022"
"Why a cash-out refinance can still be a good idea, even as rates rise",mortgages,https://www.bankrate.com//mortgages/should-you-do-a-cash-out-refinance-now/,"Here’s why a cash-out refi can still make sense, even in this economy.","May 17, 2022"
How to buy a new-construction home,mortgages,https://www.bankrate.com//mortgages/new-construction-home/,"If you’re planning to buy new construction, here are key points in the process.","Jun 06, 2022"
Key mortgage rate surges past 6% as Fed battles inflation,mortgages,https://www.bankrate.com//mortgages/mortgage-rates-surge-6-percent/,An astonishing turnaround in mortgage rates has seen the 30-year double in short order.,"Jun 15, 2022"
"Study finds Hispanic homebuyers most likely to use risky, nontraditional financing",mortgages,https://www.bankrate.com//mortgages/hispanic-homebuyers-risky-financing/,Research shows Hispanic homebuyers are most likely to pursue riskier financing.,"May 31, 2022"
Mortgage rate forecast for June 2022: Recession worries may keep rates in check,mortgages,https://www.bankrate.com//mortgages/will-mortgage-rates-go-up-in-june/,"A tug of war is playing out in the mortgage market. Inflation is pushing rates up, while fears of a recession are pulling them back down.","Jun 01, 2022"
Inflation surge puts pressure on mortgage rates,mortgages,https://www.bankrate.com//mortgages/inflation-pressures-mortgage-rates/,A surge in inflation is pushing the Fed to act — and mortgage borrowers could feel the pain.,"Jun 10, 2022"
Appraisal bias and digital redlining: No one-step solution,mortgages,https://www.bankrate.com//mortgages/appraisal-bias-and-digital-redlining/,"If steps aren’t taken, existing biases could be further perpetuated by technology.","May 09, 2022"
Homeowners with mortgages prior to 2008 still have opportunity to refinance,mortgages,https://www.bankrate.com//mortgages/homeowners-can-save-with-mortgage-refinance/,There are still some homeowners who can cut their monthly mortgage payment with a refi.,"Jun 20, 2022"
Aging in place with a cash-out refinance,mortgages,https://www.bankrate.com//mortgages/aging-in-place-cash-out-refinance/,A cash-out refinance could help pay for a full-scale aging-in-place remodel.,"Jul 20, 2022"
The Fed is set to raise rates again — but will mortgage rates follow? Maybe not,mortgages,https://www.bankrate.com//mortgages/fed-hike-will-mortgage-rates-follow/,The Federal Reserve is set to raise interest rates this week. Will mortgage rates follow?,"Jul 26, 2022"
Mortgage lenders serving Black borrowers,mortgages,https://www.bankrate.com//mortgages/mortgage-lenders-serving-black-borrowers/,These Black-led and Black-owned mortgage lenders facilitate access to the wealth-building power of homeownership.,"Aug 24, 2022"
How borrowers can cope with day-to-day volatility in mortgage rates,mortgages,https://www.bankrate.com//mortgages/rate-volatility-tips/,What to do when rates are gyrating and your mortgage close is many weeks away,"Aug 26, 2022"
What happens if you don’t pay HOA fees?,mortgages,https://www.bankrate.com//mortgages/what-happens-if-you-dont-pay-hoa-fees/,Here are some scenarios that might happen to you if you fail to pay your HOA fees.,"Jun 28, 2022"
How to manage a mortgage as debt levels reach record,mortgages,https://www.bankrate.com//mortgages/manage-mortgage-with-more-debt/,"If you’ve taken on more debt, here are tips to keep your homebuying plans on track.","Aug 16, 2022"
Why are mortgage rates moving around so dramatically?,mortgages,https://www.bankrate.com//mortgages/why-mortgage-rates-are-moving-so-dramatically/,The consensus among investors and lenders was that mortgage rates would stay at their highest levels in more than a decade.,"Jul 07, 2022"
What happens to mortgage rates in a recession?,mortgages,https://www.bankrate.com//mortgages/recession-mortgage-rates/,Here’s what we know from past cycle turns.,"Aug 08, 2022"
Higher mortgage rates aren’t stalling home prices — here’s why,mortgages,https://www.bankrate.com//mortgages/higher-mortgage-rates-not-stalling-home-prices/,Home prices keep going up even as mortgage rates rise.,"Apr 12, 2022"
