title,tag,link,description,date
Best reverse mortgage lenders in 2024,mortgages,https://www.bankrate.com//mortgages/reverse-mortgage-lenders/,Bankrate’s guide to finding the best reverse mortgage lender for you,"Jul 15, 2024"
Does a HELOC affect your credit score?,mortgages,https://www.bankrate.com//home-equity/does-heloc-affect-credit-score/,You bet — in ways both good and bad. Here’s how to judge its impact.,"Jul 12, 2024"
When is my first mortgage payment due?,mortgages,https://www.bankrate.com//mortgages/when-is-my-first-mortgage-payment-due/,It depends on the home closing date. Here’s how to make sure you don’t miss it.,"Jul 15, 2024"
The Black neighborhood home appraisal gap is real. Can we close it?,mortgages,https://www.bankrate.com//mortgages/homes-in-black-neighborhoods-more-likely-to-get-low-appraisals/,There’s still a big divide between Black and White home price tags.,"Jul 12, 2024"
Refinance appraisal: How it works and what to expect,mortgages,https://www.bankrate.com//mortgages/refinance-appraisal-how-it-works-and-what-to-expect/,Many lenders want to get an opinion of your home’s value.,"Jul 16, 2024"
How to improve your finances before your first mortgage,mortgages,https://www.bankrate.com//mortgages/improve-finances-before-mortgage/,Here are three ways to boost your financial profile — before you apply for a home loan.,"Jul 15, 2024"
How to buy a house with bad credit,mortgages,https://www.bankrate.com//mortgages/get-a-mortgage-with-bad-credit/,Have credit issues in your past? You still might qualify for a home loan.,"Jul 16, 2024"
Mortgage protection insurance: What it is and when you might need it,mortgages,https://www.bankrate.com//mortgages/do-you-need-mortgage-protection-insurance/,"This coverage can offer great benefits, but it can be expensive.","Jul 16, 2024"
What is a gift letter for a mortgage?,mortgages,https://www.bankrate.com//mortgages/gift-letter-for-mortgage/,"Many times, homebuyers turn to others to get enough cash upfront for a mortgage.","Jul 17, 2024"
What is a down payment?,mortgages,https://www.bankrate.com//mortgages/what-is-down-payment/,A home down payment is the part of a home’s purchase price you pay upfront.,"Jul 18, 2024"
Can active military get a VA loan?,mortgages,https://www.bankrate.com//mortgages/va-loan-while-deployed/,"Though far from home, you can still get an affordable VA home loan.","Jul 18, 2024"
Mortgage points: What are they and how do they work?,mortgages,https://www.bankrate.com//mortgages/mortgage-points/,They let you buy your way into a cheaper loan. But it pays to do a little analysis first.,"Jul 19, 2024"
Pros and cons of an adjustable-rate mortgage (ARM),mortgages,https://www.bankrate.com//mortgages/pros-and-cons-arm/,Adjustable mortgages have lower interest rates — at first. But be ready when it resets.,"Jul 18, 2024"
Types of mortgage lenders and how to choose,mortgages,https://www.bankrate.com//mortgages/what-are-mortgage-lenders/,"Not all lenders are alike. Here’s how to distinguish them, and why it matters for your mortgage.","Jul 18, 2024"
7 tips to save for a down payment while living paycheck to paycheck,mortgages,https://www.bankrate.com//mortgages/saving-for-house-living-paycheck-to-paycheck/,Living paycheck to paycheck makes it that much harder to save for a home. Here are our tips to overcome a tight budget.,"Jul 18, 2024"
Is doing a VA cash-out refinance a good idea? Here’s what to know,mortgages,https://www.bankrate.com//mortgages/should-you-do-va-cash-out-refinance/,Just because these generous loans let you tap all of your home equity doesn’t mean you should.,"Jul 18, 2024"
How to buy a second home,mortgages,https://www.bankrate.com//mortgages/how-to-buy-a-second-home/,Eyeing a beach bungalow or a mountain lodge? Read these tips first.,"Jun 19, 2024"
How much is a down payment on a house?,mortgages,https://www.bankrate.com//mortgages/how-much-is-a-down-payment-on-a-house/,"The down payment question may sound like a simple one, but it has many answers.","Jun 19, 2024"
What is the average down payment for first-time homebuyers?,mortgages,https://www.bankrate.com//mortgages/down-payment-for-first-time-homebuyers/,The average down payment for first-time homebuyers is considerably less than the oft-quoted 20 percent down payment requirement.,"Jun 18, 2024"
Guide to FHA adjustable-rate mortgages,mortgages,https://www.bankrate.com//mortgages/fha-arm-guide/,"It’s pretty similar to any ARM — and despite the low intro rates, it comes with caveats.","Jun 17, 2024"
How does a fixed-rate HELOC work?,mortgages,https://www.bankrate.com//home-equity/heloc-with-fixed-rate-option/,It’s a hybrid product that can combine the best of both borrowing worlds.,"Jun 20, 2024"
How to refinance when you have a second mortgage,mortgages,https://www.bankrate.com//mortgages/refinance-second-mortgage/,It’s not as easy to refinance your mortgage when you have equity debt. Here are the options.,"Jun 18, 2024"
Do I lose home equity after refinancing?,mortgages,https://www.bankrate.com//home-equity/do-i-lose-home-equity-after-refinancing/,"Depending on the type of refinance, the amount you owe could deplete the amount you own.","Jun 17, 2024"
Do you need a down payment to refinance your mortgage?,mortgages,https://www.bankrate.com//mortgages/do-i-need-money-down-to-refinance/,"Usually, no. But you still need to have some cash on hand at the closing.","Jun 18, 2024"
How generative AI is changing the mortgage process,mortgages,https://www.bankrate.com//mortgages/how-generative-ai-is-changing-mortgage-process/,Mortgage experts explain how generative AI is being used in mortgage lending.,"Jun 27, 2024"
Documents needed for mortgage preapproval,mortgages,https://www.bankrate.com//mortgages/documents-for-preapproval/,Here’s a checklist of what you need to get a mortgage preapproval letter.,"Jun 27, 2024"
Mortgage lender vs. servicer: What’s the difference?,mortgages,https://www.bankrate.com//mortgages/mortgage-servicer-vs-lender/,What happens when your loan moves to a new servicer?,"Jun 25, 2024"
USDA loans: What are they and am I eligible?,mortgages,https://www.bankrate.com//mortgages/what-is-a-usda-loan/,USDA loans require no down payment and are designed for low- to moderate-income homebuyers.,"Jun 26, 2024"
How to pay a mortgage: 5 ways to pay on time,mortgages,https://www.bankrate.com//mortgages/making-mortgage-payment/,"Yes, you can write a check, but there are better ways to pay your mortgage.","Jun 25, 2024"
Guide to first-time homebuyer loans and programs,mortgages,https://www.bankrate.com//mortgages/first-time-homebuyer-loans-and-programs/,A comprehensive guide to grants and other tools that can make your homeownership dreams come true.,"Jun 26, 2024"
How to improve your credit score for a mortgage,mortgages,https://www.bankrate.com//mortgages/improve-credit-before-mortgage/,"The higher your score, the better your approval chances, and the lower the interest rate.","Jun 24, 2024"
How to remove mortgage insurance on an FHA loan,mortgages,https://www.bankrate.com//mortgages/remove-fha-mortgage-insurance/,Here’s how to cut this monthly insurance cost it if you’re eligible.,"Jun 26, 2024"
5 types of mortgage loans for homebuyers,mortgages,https://www.bankrate.com//mortgages/types-of-mortgages/,A comprehensive list to help you find the right financing tool for your dream home.,"Jun 11, 2024"
VA construction loan: How to build your home via a VA loan,mortgages,https://www.bankrate.com//mortgages/va-construction-loan-process/,"It has many advantages, but getting one’s a painstaking process.","Jun 11, 2024"
Questions to ask a mortgage lender,mortgages,https://www.bankrate.com//mortgages/questions-to-ask-mortgage-lender/,Wondering what to ask a mortgage lender when you’re shopping around for offers? Here’s a list of questions to ask a mortgage loan officer.,"Jun 10, 2024"
VA loan benefits and disadvantages,mortgages,https://www.bankrate.com//mortgages/va-loan-pros-cons/,"There’s a flip side to every form of financing, and VA loans are no exception.","Jun 12, 2024"
How long should I keep mortgage statements and documents?,mortgages,https://www.bankrate.com//mortgages/how-long-to-keep-mortgage-documents/,And do you need to keep all of them?,"Jun 14, 2024"
Mortgage prequalification: What it is and how to get it,mortgages,https://www.bankrate.com//mortgages/mortgage-prequalification/,"Think of it as mortgage preapproval lite. Easier to get, but less useful too.","Jun 13, 2024"
How to find the best FHA mortgage lender,mortgages,https://www.bankrate.com//mortgages/find-best-fha-lender/,"You’ll need to do a bit of legwork to find a good fit, but it’s worth it to get one of these loans.","Jun 10, 2024"
How much is an FHA loan down payment?,mortgages,https://www.bankrate.com//mortgages/fha-loan-down-payment/,These loans are made for folks who are struggling to afford a home of their own.,"Jun 13, 2024"
First-time homebuyer guide,mortgages,https://www.bankrate.com//mortgages/first-time-homebuyer-guide/,"Being a novice often feels like a nuisance. However, there are actually perks to being a first-timer.","Jun 20, 2024"
What happens when you pay off your mortgage?,mortgages,https://www.bankrate.com//mortgages/what-happens-when-mortgage-is-paid-off/,"First, you celebrate. But remember: You’ve got some new obligations too.","Jun 24, 2024"
What are construction loans?,mortgages,https://www.bankrate.com//mortgages/construction-loans-explained/,"They’re not just mortgages for new builds, and you need to know their unique wrinkles.","Jun 20, 2024"
How to get a mortgage,mortgages,https://www.bankrate.com//mortgages/how-to-get-a-mortgage/,Follow these 10 steps to nail the loan and make buying that home a reality.,"Jun 20, 2024"
I chose this type of mortgage lender to buy my first home — and it was the best decision I made,mortgages,https://www.bankrate.com//mortgages/mortgage-from-local-credit-union/,Bankrate editor Laurie Richards shares why she worked with a local mortgage lender to buy her first home.,"Jun 20, 2024"
Divorce and your mortgage: Here’s what to know,mortgages,https://www.bankrate.com//mortgages/what-to-know-about-divorce-and-mortgage/,"If the martial home has a lien on it, things can get complicated.","Jun 24, 2024"
Guide to no-down payment mortgages: Am I eligible?,mortgages,https://www.bankrate.com//mortgages/no-down-payment-mortgage/,Some options if you want a house but your savings are small.,"Jun 24, 2024"
Guide to manufactured and mobile home loans,mortgages,https://www.bankrate.com//mortgages/manufactured-mobile-home-loans/,There are many ways to finance a manufactured or mobile home. Here’s a guide to your options.,"Jun 24, 2024"
What is an FHA mortgage insurance premium?,mortgages,https://www.bankrate.com//mortgages/fha-mortgage-insurance-guide/,It’s an extra expense — the price you pay for the FHA loan’s generosity.,"Jul 02, 2024"
First-time homebuyer qualifications,mortgages,https://www.bankrate.com//mortgages/first-time-homebuyer-explained/,You can be a “first-time homebuyer” — and get financial aid — even if you’ve owned a place before.,"Jul 03, 2024"
Are cash-out refinance rates higher? How to get the best rate,mortgages,https://www.bankrate.com//mortgages/how-to-get-the-best-cash-out-refinance-rate/,The cash you’ll get comes at cost. Here’s how to minimize it.,"Jul 02, 2024"
Are home equity loans tax-deductible?,mortgages,https://www.bankrate.com//home-equity/home-equity-loan-tax-changes/,"Home equity borrowers can deduct interest, but only if they meet these requirements.","Jul 03, 2024"
How to get the best mortgage rate,mortgages,https://www.bankrate.com//mortgages/how-to-get-the-best-mortgage-rate/,"With interest rates rising, shopping around is more important than ever.","Jul 03, 2024"
How to increase your mortgage preapproval amount,mortgages,https://www.bankrate.com//mortgages/how-to-increase-mortgage-preapproval-amount/,Getting preapproved for the right mortgage amount is the first step in getting your dream home. Here’s how to wangle more from your lender.,"Jul 02, 2024"
The secret to getting a mortgage as a single person: Your lender,mortgages,https://www.bankrate.com//mortgages/single-person-mortgage/,Is it harder to get a mortgage if you’re single?,"Jul 08, 2024"
Reverse mortgage pros and cons,mortgages,https://www.bankrate.com//mortgages/reverse-mortgage-pros-and-cons/,Is a reverse mortgage right for you?,"Jul 03, 2024"
Mortgage deferment: What it is and how it differs from forbearance,mortgages,https://www.bankrate.com//mortgages/mortgage-deferment/,"Although used interchangeably, deferment isn’t the same as forbearance.","May 28, 2024"
About 1 in 5 homeowners say they’ve taken on debt for maintenance and surprise costs: Is it a good idea?,mortgages,https://www.bankrate.com//mortgages/unexpected-costs-of-homeownership/,Close to one-fifth of homeowners have borrowed money to pay for unexpected maintenance and repairs.,"May 28, 2024"
Refinancing for home improvement: How it works,mortgages,https://www.bankrate.com//mortgages/refinancing-for-home-improvement/,"Tapping your home to upgrade your home: A good idea, but beware the potential pitfalls.","May 28, 2024"
Are government loans easier to get?,mortgages,https://www.bankrate.com//mortgages/government-loans-easier-to-get/,Here’s why you can’t believe the hype.,"May 29, 2024"
Missing mortgage payments: How many can I miss before foreclosure?,mortgages,https://www.bankrate.com//mortgages/how-many-mortgage-payments-can-i-miss/,It’s not the end if you miss just one. But don’t make a habit of it.,"May 28, 2024"
Does refinancing a mortgage hurt your credit?,mortgages,https://www.bankrate.com//mortgages/does-refinancing-hurt-your-credit/,"Yes, it can ding it, sometimes dramatically. But there are ways to minimize the drop.","May 29, 2024"
Mortgage questions to expect from your lender,mortgages,https://www.bankrate.com//mortgages/questions-to-expect-from-lenders/,"To get the right answers (and the right mortgage), you have to ask the right questions. And be ready to answer a lot, too.","May 28, 2024"
Jumbo vs. conventional loans: What’s the difference?,mortgages,https://www.bankrate.com//mortgages/jumbo-vs-conventional-loans/,Eyeing a high-priced home? Opting for a jumbo loan may be a necessity.,"May 30, 2024"
"Study: Typical single-family home costs over $18,000 per year in hidden expenses",mortgages,https://www.bankrate.com//mortgages/hidden-costs-of-homeownership-study/,"For the average single-family homeowner, ongoing yearly expenses have increased 26 percent since 2020, according to a new Bankrate study.","Jun 10, 2024"
VA closing costs: What are they and how much are they?,mortgages,https://www.bankrate.com//mortgages/va-loan-closing-costs/,"They’re often lower, but they still can add up. Here’s what to look for.","Jun 07, 2024"
What is a VA streamline refinance (VA IRRRL) and how does it work?,mortgages,https://www.bankrate.com//mortgages/va-irrrl-refinance-program/,A fast and easy way to cut the interest payments on your VA home mortgage.,"Jun 07, 2024"
Home equity hazards: The risks of tapping your property’s value,mortgages,https://www.bankrate.com//home-equity/home-equity-loan-risks-and-how-to-avoid-them/,"Tapping home equity can be a smart move, but don’t get trapped by surprise terms.","Jun 10, 2024"
What is the VA funding fee?,mortgages,https://www.bankrate.com//mortgages/va-funding-fee/,"VA loans come with a one-time funding fee. Here’s why, how much it costs and how to pay it.","Jun 07, 2024"
What is a construction-to-permanent loan?,mortgages,https://www.bankrate.com//mortgages/construction-to-permanent-loans/,The upside of a construction to permanent loan: The borrower only pays for a single transaction.,"Jun 06, 2024"
What is a debt-to-income ratio for a mortgage?,mortgages,https://www.bankrate.com//mortgages/why-debt-to-income-matters-in-mortgages/,"It varies, but generally, the lower the better. Here’s why.","Jun 07, 2024"
Guide to refinancing an FHA loan to a conventional loan,mortgages,https://www.bankrate.com//mortgages/refinance-fha-to-conventional/,Crunch the numbers carefully to see if the switch is worth it.,"Jun 06, 2024"
VA loan refinance: What is it and how does it work?,mortgages,https://www.bankrate.com//mortgages/refinance-into-a-va-loan/,"If you qualify, a VA refinance can be a great way to snag a low rate.","May 31, 2024"
How to choose a mortgage lender: 6 tips,mortgages,https://www.bankrate.com//mortgages/finding-the-best-mortgage-lender/,Getting a good loan starts with choosing the right lender.,"May 31, 2024"
Is private mortgage insurance (PMI) tax-deductible?,mortgages,https://www.bankrate.com//mortgages/deduct-private-mortgage-insurance/,Homeowners who are paying PMI may be able to deduct this cost once again. Here’s how.,"May 31, 2024"
Can I get a mortgage after a short sale of my home?,mortgages,https://www.bankrate.com//mortgages/home-loan-after-short-sale/,"To buy a home after you sold one in a short sale, you need time, good credit and money down.","Jun 03, 2024"
What is a fixed-rate mortgage and how does it work?,mortgages,https://www.bankrate.com//mortgages/what-is-a-fixed-rate-mortgage/,It’s America’s favorite home loan by far. But is it the best choice for you?,"May 31, 2024"
Should I pay off my mortgage or invest?,mortgages,https://www.bankrate.com//mortgages/pay-off-mortgage-or-invest/,Both strategies have merit. Here’s what to consider.,"Jun 03, 2024"
Younger generations wrestle with competing goals: Financial flexibility and owning a home,mortgages,https://www.bankrate.com//mortgages/financial-flexibility-vs-homeownership/,Younger generations want to buy homes — but they also want the freedom to grow their careers and spend on experiences.,"Jun 04, 2024"
How your mortgage affects your credit score,mortgages,https://www.bankrate.com//mortgages/how-mortgage-affects-credit-score/,Does it ding it? Increase it? It can do both. Here’s what to expect.,"Jun 04, 2024"
Pros and cons of a cash-out refinance,mortgages,https://www.bankrate.com//mortgages/cash-out-refinance-pros-cons/,"It can be fast, easy money — but it comes with caveats.","May 21, 2024"
Hard money lending: Guide to hard money loans and lenders,mortgages,https://www.bankrate.com//mortgages/hard-money-lenders/,These loans appeal to house flippers or those with unusual situations.,"May 21, 2024"
Student loan guidelines for getting a mortgage,mortgages,https://www.bankrate.com//mortgages/mortgage-student-loan-guidelines/,Here’s how student loans typically factor into getting a mortgage.,"May 20, 2024"
Secondary mortgage market: What it is and how it works,mortgages,https://www.bankrate.com//mortgages/secondary-mortgage-market/,"As a homeowner, you don’t know it, but it affects who may actually own your home loan.","May 21, 2024"
Deed of reconveyance: What it is and how it works,mortgages,https://www.bankrate.com//mortgages/deed-of-reconveyance/,"If the deed of reconveyance hasn’t been recorded, don’t panic just yet.","May 20, 2024"
How to save for a down payment,mortgages,https://www.bankrate.com//mortgages/how-to-save-for-a-down-payment/,Saving the big chunk of cash you’ll need upfront can be tough. These tactics help.,"May 20, 2024"
Mortgages and loans to pay for home renovations,mortgages,https://www.bankrate.com//mortgages/mortgages-pay-home-renovations/,Financial tools to make that project happen — provided you pick the right one for your needs.,"May 21, 2024"
16 first-time homebuyer mistakes to avoid,mortgages,https://www.bankrate.com//mortgages/first-time-homebuyer-mistakes/,"And the ways to do things right, from perusing the neighborhood to comparing mortgage terms.","May 21, 2024"
Getting a mortgage at a young age: Can and should you do it?,mortgages,https://www.bankrate.com//mortgages/are-you-too-young-to-buy-a-house/,Are you too young to buy a home?,"Jun 05, 2024"
Government grants for home improvements,mortgages,https://www.bankrate.com//mortgages/home-improvement-grants/,Find out whether you qualify for grant money to fund home repairs.,"Jun 06, 2024"
How does a condo mortgage work?,mortgages,https://www.bankrate.com//mortgages/condo-financing/,"To improve your chances of getting approved for condo financing, follow these tips.","Jun 06, 2024"
How much equity do you need to refinance?,mortgages,https://www.bankrate.com//mortgages/refinance-home-equity-is-important/,There are many refinance options based on level of equity.,"Jun 04, 2024"
Mortgage rate lock: What it is and when you should use one,mortgages,https://www.bankrate.com//mortgages/what-is-mortgage-rate-lock/,It can make sure you don’t get burned by rising interest rates before you close.,"May 23, 2024"
Bank statement loan: What is it and who should get one?,mortgages,https://www.bankrate.com//mortgages/bank-statement-loan/,"While an option for some borrowers, there are downsides.","May 24, 2024"
What is a first mortgage?,mortgages,https://www.bankrate.com//mortgages/what-is-a-first-mortgage/,It’s what we think of when we think “mortgage”: a big loan used to buy a home.,"May 23, 2024"
Bankrate’s 2024 Home Affordability Report,mortgages,https://www.bankrate.com//mortgages/home-affordability-report/,"Despite costs and regrets, most Americans still value homeownership.","May 22, 2024"
What are guaranteed mortgage loans?,mortgages,https://www.bankrate.com//mortgages/guaranteed-loan/,"In short, without guaranteed mortgages, there would be a lot fewer home sales.","May 24, 2024"
What to do when your mortgage forbearance period ends,mortgages,https://www.bankrate.com//mortgages/what-to-do-if-your-mortgage-forbearance-is-ending/,Here are options if your mortgage forbearance plan is expiring.,"May 24, 2024"
How to get a mortgage when you’re self-employed,mortgages,https://www.bankrate.com//mortgages/self-employed-how-to-get-a-mortgage/,"True, the path to homeownership will be bumpier, but these tips can help you navigate it.","May 23, 2024"
Younger would-be homebuyers are moving back in with their parents: Should you?,mortgages,https://www.bankrate.com//mortgages/living-with-parents-to-save-for-home/,Younger aspiring homebuyers face a tougher road financially compared to even a few short years ago.,"May 22, 2024"
Home Mortgage Disclosure Act (HMDA): What it is and why it’s important,mortgages,https://www.bankrate.com//mortgages/home-mortgage-disclosure-act/,It’s a way that you can get a sense of how a lender treats borrowers like you.,"May 14, 2024"
What is a 5/1 adjustable-rate mortgage (ARM)?,mortgages,https://www.bankrate.com//mortgages/what-is-a-5-1-arm/,A 5/1 ARM is a common type of adjustable-rate mortgage.,"May 10, 2024"
Should I use a home equity loan to buy a car?,mortgages,https://www.bankrate.com//home-equity/buy-car-loan-with-home-equity-loan/,"It’s not so much whether you can, but if you should.","May 17, 2024"
FHA vs. conventional loans: What’s the difference?,mortgages,https://www.bankrate.com//mortgages/fha-vs-conventional-loans/,Is one better than the other? Here are the pros and cons of each.,"May 16, 2024"
Mortgage application: What’s included  and how to prepare,mortgages,https://www.bankrate.com//mortgages/mortgage-application-questions/,You have to know all the questions to give the right answers.,"May 17, 2024"
"What is collateral for a mortgage, and how does it work?",mortgages,https://www.bankrate.com//mortgages/collateral-for-mortgage/,It’s usually the home you’re buying — and it’s on the line if you can’t repay the loan.,"May 13, 2024"
5 biggest myths about mortgage refinance,mortgages,https://www.bankrate.com//mortgages/biggest-refinance-myths/,Don’t let lack of knowledge hold you back from refinancing.,"May 13, 2024"
The lock-in effect is keeping homes off the market. How long will it last?,mortgages,https://www.bankrate.com//mortgages/lock-in-effect/,"Homeowners are staying on the sidelines of the housing market, biding their time.","May 20, 2024"
Should you buy a second home?,mortgages,https://www.bankrate.com//mortgages/things-to-know-before-you-buy-a-second-home/,Is owning a second home a ton of work or a ton of fun?,"May 01, 2024"
The 10 largest mortgage lenders in the U.S.,mortgages,https://www.bankrate.com//mortgages/largest-mortgage-lenders/,UWM claims the top spot on the latest list.,"May 02, 2024"
What is a mortgage?,mortgages,https://www.bankrate.com//mortgages/what-is-mortgage/,"A primer on how these home loans work, including the lingo you need to know.","May 07, 2024"
Mortgages for seniors: Getting a home loan in retirement,mortgages,https://www.bankrate.com//mortgages/mortgages-for-seniors-getting-a-home-loan-in-retirement/,"It can be tougher to qualify. Here’s why, and how to bridge the gap.","May 03, 2024"
How to shop for a mortgage without hurting your credit score,mortgages,https://www.bankrate.com//mortgages/shop-for-mortgage-without-hurting-credit-score/,"A drop is inevitable, but you can minimize it.","May 02, 2024"
How to refinance a second home or investment property,mortgages,https://www.bankrate.com//mortgages/second-home-refinancing/,The rules are different for refinancing a second home or investment property.,"May 02, 2024"
Conventional loans: What they are and how they work,mortgages,https://www.bankrate.com//mortgages/what-is-a-conventional-loan/,"In short, it’s a mortgage not guaranteed by the government. Is it the right one for you?","May 02, 2024"
10 first-time homebuyer tips: How to get that house,mortgages,https://www.bankrate.com//mortgages/tips-for-first-time-home-buyers/,"These steps will help rookies streamline the process, avoiding bumps on the homebuying road.","May 06, 2024"
